titles,category
유가    달러 넘나 중동전쟁에  오일쇼크  우려,Economic
 공기업 다 왜이래  도로공사   조 빚더미  연간이자만  조,Economic
 만원짜리 샴푸 누가 쓰냐고    이 나라에서는 불티나게 팔렸다던데  내일은 유니콘 ,Economic
 집값 오르는데 물려주지 말고 팔자  증여 비중  년 개월 만에 최저,Economic
게임주 벌써     넘게 빠졌는데   언제 볕 드나,Economic
레깅스는 바지인가 속옷인가 골머리 앓는 관세당국  왜,Economic
 킹스닥 반등에 좋아라했는데 전쟁이라니  중동 전운에 투자자들 울상,Economic
한국공항공사  전기충격기 공항 검색대 통과시켜 금속탐지기 전원 꺼진 사실도 몰라,Economic
 판교 안 부러워  이 동네 아파트  주 만에  억 올랐다,Economic
 어떻게 모은 돈인데  수원 대규모 전세사기 의심에 임차인 발동동,Economic
 미리보는 경제   비싼 차에 더 많은 세금을  전기차는 어떻게 ,Economic
 뉴스분석  전기요금   월 초중순 두 자릿수 인상가나       상한제  초강수도 효과 미미,Economic
삼성페이에 면허증 보훈증 쏙  내년부터 신분 확인 결제 동시에 된다,Economic
이재용 직접 챙긴 이스라엘 불붙은 화약고에 촉각 곤두세운 기업들,Economic
 대출 무심코 갈아탔다가  수수료만 잔뜩   대 은행   년간     억원 벌었다 머니뭐니 ,Economic
오산은 미달났는데 여기는    대    청약 불붙은 다크호스는,Economic
 대 은행 주담대 약  년 만에 가장 많이 늘어    조 ,Economic
또 한전채 한도 초과 비상 업계   분기 전기요금   원   인상돼야   ,Economic
 대 은행 주담대 약  년 만에 가장 많이 늘어    조 ,Economic
또 한전채 한도 초과 비상 업계   분기 전기요금   원   인상돼야   ,Economic
침체 빠진  부동산 시장   세금유예 대출 확대  약발 먹힐까  글로벌 리포트 ,Economic
운전면허증도 삼성페이로 쏙  지갑 없는 세상  온다,Economic
 양재찬의 프리즘  가계부채 부추기는 정책부터 없애야,Economic
영화 관객에 발전기금    걷어가고 출국할 땐    만원 떼어가,Economic
영화 볼 때도 출국할 때도 나도 모르게 강제 기부    조 ,Economic
길어진 공정위 소송  년 내 사건 종결    뿐,Economic
서울 아파트 경매물건 쌓인다  강남 등엔 응찰 몰려  양극화 ,Economic
이제 와서 산은법 개정이 먼저라는 국힘 김희곤,Economic
급습당한 이스라엘  대공습 낌새도 못 챘다  정보 실패  논란,Economic
 이차전지주 팔자 나선 외국인 석달 새 코스피  조 넘게 순매도,Economic
  년 전  석유파동  또 일어나나  유가 단기간 요동 ,Economic
수원 대규모 전세사기 현실화하나 고소장 접수   명 넘어서,Economic
단  만    대    하이브리드카  올해 경유차 첫 추월하나,Economic
목표가 못 미치는 시총상위주  괴리율 최대    까지 급등,Economic
밀리의서재 두산로보 연타석 흥행   미래에셋      주관 경쟁서 웃을까,Economic
 이번엔 질 수 없다  구글의 반격  비밀 병기  내놓는다,Economic
 초거대   가 곧 국력  혈투 벌이는    ,Economic
   대  치솟는 주담대 금리에도  멈추지 않는 부동산 영끌,Economic
 한판 붙어보자  머스크 스페이스   아마존  위성 인터넷시장에 도전장,Economic
 극강으로 맵거나  혹은 아주 순하거나  라면맛도  양극화 ,Economic
 년새   조 급증한     예산  기재부  구조조정 불가피   국회 심의 앞둔 내년도 예산 ,Economic
 깡통주택   곳 중  곳 보증금 못 돌려줘 사고    가 다세대,Economic
  전기차 대신 중국산 배터리가 몰려온다,Economic
      동결이냐 인상이냐   고환율 고물가 고금리 에 고민  물가 폭등 속 한은의 선택 ,Economic
    억 주고 샀는데 날벼락  강남 건물주 한숨 쉰 사연,Economic
 입주 기다리느니 포기   사전청약 무용론,Economic
 믿을 건 서울 아파트 뿐  지방 투자자들 출동한 동네는,Economic
 인당     만원 줘야할 판  포스코 사상 첫 파업 위기,Economic
      헤엄쳐 익수자 구조  울산해경 박철수 경사   의인상,Economic
   금리에도 가계대출 폭증    안 잡나 못 잡나 ,Economic
고금리 장기화에   내년 국채 이자만   조,Economic
이스라엘 전쟁에 현지판매  위 현대차 초긴장   전자  재택근무 돌입,Economic
전세사기 대책 엇박자에 피해자들  실제 지원 받기는 하늘의 별따기 ,Economic
 삼겹살보다 더 비싼 깻잎  고기에 채소 쌈 싸 먹을 판,Economic
가계대출 폭증 뒤엔 대기업보다 싼 금리,Economic
일상 속 배터리 야무지게 오래 쓰는 꿀팁,Economic
금융당국 압박에 가계대출 문턱 높이고   에 자금대는 은행들,Economic
구로 한복판에 섬이 있다고   구일섬    층 아파트 생긴다  부동산    ,Economic
반등 돌아선  램 현물가 삼성 하이닉스  분기엔 흑자 전환 ,Economic
    배터리의 습격  중국산 배터리 수입량      급증,Economic
식지않는 청약열기   인천 검단 경쟁률  쑥 ,Economic
증여 취득세 수천만원 늘자 강남권  차라리 집 팔겠다 ,Economic
의정부 논산 용산   군부대 떠난자리 속속 아파트 단지로,Economic
석유파동   년만에 중동서 전쟁 석유값  배 뛴 그때와 다르다 ,Economic
    오부치 선언    주년   언론    새 선언 기대하나  은 관망 ,Economic
이재용 열흘 전 찾았던 이스라엘 전쟁 선언    현지  위 현대차도 촉각,Economic
 단독 지난해 근로장려금 신청 대상   만 가구 신청 안해 세명 중 한명은 안내문도 못받아,Economic
한국차에도 중국산 배터리 가성비에 경쟁사  고민 ,Economic
이스라엘 하마스  중동전쟁 확전 우려 국내 증시 영향은 ,Economic
땅 투기막는  농지법   주말농장 귀농귀촌 가로막아  랜드푸어  양산 어쩌나,Economic
운전면허증이 삼성페이에  쏙  신분 확인과 결제 한번에,Economic
   페이 납부  보험사 걱정 커지는 이유,Economic
 설탕 범벅 탕후루 가격 오를라  설탕값    년 만에 최고,Economic
 달라도 어쩜 이렇게 다를까  네이버 카카오 희비 교차,Economic
자존감 찾기 위한   대 창업 준비할 때다,Economic
월가에서 엇갈린 평가 받는 루시드 리비안 이유는,Economic
메모리 반도체 불황 끝     램 현물가격 반등,Economic
암초만난 일회용품 감축 정책   카페 일회용컵 편의점 비닐봉지 사용 이어지나,Economic
 차 석유파동   년 만에 발발한 이스라엘 하마스 전쟁에 국제 유가 촉각,Economic
백만원짜리 물건   억 내고     만원 환불받은 아빠  처벌 받았다 왜 ,Economic
 전국 팔도 소주 열전  여행가서 맛볼 지역별 향토 소주는,Economic
    고금리 무색하네  시중은행 주담대   년 만에 최대폭 증가,Economic
무주택도 서러운데 전세 보증금 떼이는 세입자 폭증,Economic
 적립금  배  럭셔리웨딩  모시기 사활건 백화점,Economic
 차라리 팔겠다  전국 주택 증여 비중   년 개월 만에  최저 ,Economic
최고가 찍더니     폭락  잔혹사  이어져도 상장 목메는 이유,Economic
불황에 가격 올리겠다   신의 한수  두겠다는 이 기업  주가는    위클리반도체 ,Economic
국민연금 더 내고 더 늦게 받을까      일 개혁안 시선집중,Economic
이날을 위해   년을 기다렸다 조합설립후 신고가 근접한 은마 부동산    ,Economic
 자식 줄 바엔 그냥 팔래  주택 증여  년   최저  왜 ,Economic
 중국산 테슬라 만 무섭게 팔렸다 싼 맛에 보조금까지 싹쓸이,Economic
내년부터 삼성페이에 모바일 운전면허증 들어간다,Economic
 이자장사 하지마  역효과   고신용  대기업보다 싼 가계금리,Economic
고금리 속 불 붙는 자영업자 부동산 연체율 폭탄       국감 핫이슈 ,Economic
희망고문 당하기 싫다   사전청약 실효성 논란,Economic
코로나 때도 이랬나   여윳돈  더 줄어    이자에 고물가까지  주머니 더 빠듯 ,Economic
 벌써 영하 날씨 전기 가스요금도 오르면 어떻게 사나  때이른 추위에 떨고 있는 서민들,Economic
천장 뚫은 환율에 물가 들썩  금리인상 가능성 열어둔 한국은행 선택은 ,Economic
목표가 한참 못 미치는 시총 상위주  괴리율 급등,Economic
 뜨겁고 변색되고  아이폰   별거 없네  한국 중국의  역전 한방 은  박민기의 월드버스 ,Economic
  년만에 최대  서울 경매 아파트 쌓였다,Economic
김종인 장하준 등 사칭 가짜 광고 기승  빅테크 대응 한심 ,Economic
지난달 늘어난 주담대   조원 육박  집값 기대감 이  금리 넘었다,Economic
국민연금 개혁안   일 최종 논의 노후 보장성 강화 담길까,Economic
 두산로보  히트에    명가  도약   연이은    흥행 이끈다,Economic
공모가 대비  배 뛰었던 지오엘리먼트 급등주 지금은 ,Economic
면 먼저    스프 먼저 라면  장인 들이 픽한 레시피는 ,Economic
    과 개방형 반도체 설계기술 협력도 통제할까  의원들         규제 필요 ,Economic
커다란 원형감옥 속 콜센터 상담사의 눈물        관점 ,Economic
  일자리 늘어도 안심할 수 없는 세 가지 이유,Economic
올들어 중국산 배터리 수입 두배로 급증,Economic
국평   억에도 경쟁률    대   공급 대책에도 분양가 뛴다,Economic
최정우 포스코 회장  올 국감서도  골프  논란 예고  올해가 훨씬 중차대한 이유,Economic
주담대  년 만에 최대폭 상승  은행들 금리인상 검토,Economic
기업대출 한달새  조원 증가  자금쏠림  막을 수 있나 머니뭐니 ,Economic
주식 계좌 녹아내리지만    킹달러  투자자   나 홀로 미소 ,Economic
이젠 기술력으로 승부 농슬라 경쟁 본격 시작,Economic
리플   중간 항소 기각 에 날아오를까,Economic
 헉  면허증 없네  난감상황 사라진다 삼성페이에 신분증  쏙 ,Economic
네이버페이 포인트  이제는 기업 내  복지 포인트 로 뜬다   오피스     시공간 제약 없어 편리 ,Economic
금감원 직원  명중  명  쉬거나 후배 밑에서 일해요 ,Economic
 깡통주택   곳 중  곳  전세금 못 돌려받았다,Economic
유한양행  코스피  톱   바이오주 등극했다,Economic
 이복현 국감  벼르는 국회  조 투자자 피눈물 최훈길의뒷담화 ,Economic
  대까지 오른 정기예금  추석 용돈  넣을 만한 곳 어디 ,Economic
 너도나도 로얄  캐슬   길어도 너무 긴 아파트 이름   펫네임 이라고   김유진의 브랜드피디아 ,Economic
조선업 호황이라는데 실적은 아직  주춤  언제 볕들까  비즈    ,Economic
 고금리 장기화에 유동성 위기  건설사 줄도산  빨간불 ,Economic
잘 만든 전기차도 충전 불편하면  꽝  몸값 높아지는 충전 인프라      플러스 ,Economic
 금사과 금상추  이어  금깻잎   삼겹살보다 비싸   신선 농산물값  훌쩍 ,Economic
기상청의  매의 눈  천리안위성 운영센터 가보니,Economic
누가 싼타페에 밀린대  굳히기 들어간  명불허전 쏘렌토   여 저  ,Economic
 대 시중은행 주담대  년만  최대폭 ,Economic
암으로 고통받던 고양이 크리스마스에 생긴 기적 벳앤패밀리 ,Economic
회사 그만두고 여행하고 맛집 다니며  억대 연봉  유튜버 수입  현실은 냉혹,Economic
 살림하고 나면 쓸 돈이 없어요   분기 가계 흑자액  뚝 ,Economic
이스라엘 하마스  전면전  양상 사망자 이미    명 넘어,Economic
벌려놓은 판     조  근로자 무관심만 탓하기엔 구멍  숭숭   빈수레 디폴트옵션  ,Economic
매달   만원씩 연금 부은   세      년 후 퇴직하면 얼마 받나 보니  왕개미연구소 ,Economic
 쓸 돈이 없다  가계  여윳돈      감소 고금리 고물가에 소득은 ,Economic
 취득세 부담에 증여 대신 판다  전국 주택 증여 비중  년여만에 최저,Economic
     만원 받고 집 고치세요  서울시 노후주택 찾는다,Economic
 평단   만원인데  카카오 신저가에 개미들  곡소리 ,Economic
 박한나의 배터리       엔솔에서   온으로 이직 가능할까  ,Economic
부채비율     초과  깡통주택    곳 중  곳꼴 보증사고 발생,Economic
헉  홈쇼핑서 산 명품이 짝퉁이라고  법적 처벌도 쉽지 않다는데   ,Economic
이스라엘  팔레스타인 무장세력 파괴 결정 전면전 가나,Economic
 고급 일자리 있어야  미래 주택시장도 보장  더 머니이스트 심형석의 부동산정석 ,Economic
또 한전채 한도 초과 우려  분기  전기요금 인상 여부  수면 위로,Economic
  전기차 주가  우수수  서학개미 눈물의 물타기,Economic
올해치 지방정부 교부금 삭감 세수결손 떠넘기기,Economic
수도권 교통혁명       수서 동탄  내년  월 부분 개통,Economic
아파트값 상승세   분기부터 소강 국면 접어들듯,Economic
은퇴 후 인생 레벨은 돈이 결정,Economic
삼전 현대차 등    연합  가입      에서 원전 포함    로,Economic
원 달러 환율      원 넘을까 고금리 컴백  ,Economic
 삼성전자 지금이 주가 바닥  다음 주   만전자  벗어날까  선데이 머니카페 ,Economic
 전세사기 피해  최대  억 대출 지원  다가구 후순위 세입자는요   부동산백서 ,Economic
코넥스 숨은 진주가 여기 있네 연평균     성장하는  이 기업 ,Economic
 전세사기 피해  최대  억 대출 지원  다가구 후순위 세입자는요   부동산백서 ,Economic
 기업기상도  제철 만나 맑은 기업    역풍 맞아 흐린 기업,Economic
 빚  쓰나미 몰려오는데 대출금리  더  뛴다  머니뭐니 ,Economic
 무턱대고 오마카세 먹고 인증샷 목매더니   터질게 터졌다  이슈  ,Economic
 이더리움 선물      롤오버 비용 발생으로 장기투자 불리할 듯   투자    ,Economic
세계 장악한 엔터 는 왜  변동성의 늪 에 빠졌나   리즈 ,Economic
 주간    구본무 선대회장의      롤렉스  올해는 주인 찾나,Economic
 금리 절대 안 내린다  대출 위기 시한폭탄 켜졌나 ,Economic
 레이더로 자율주행차 넘어 코골이 시장까지 공략하죠   긱스 ,Economic
배송하다 사고 몇번 나면 철창행  보험사기로 몰렸다  어쩌다 세상이 ,Economic
근로시간 실업급여 노조회계  암초  가득  정부 노동개혁 평가전,Economic
고금리 시대 언제까지 인플레  재정적자  양적긴축에 답 있다,Economic
홈쇼핑과 케이블    미래 없는 을들의 싸움,Economic
국감 의식했나  국토부  양평고속도로 변경안  원안보다 경제성 높다 ,Economic
 여보  오늘부터 우리도 대출 된대  전세사기 피해자  억대 연봉자도 저리 대출,Economic
블랙핑크만 바라보는    주가 아티스트에 울고 웃는 엔터주,Economic
박찬호  입담 만큼 부동산 재력도 화려하네 누구집 ,Economic
상속재산   억 넘는다면 배우자 상속공제 활용해보세요 세금   ,Economic
최초  냉장고 남자모델 은 누구  그때 그 광고로 보는 삼성    이야기   노우리의 플러그인 ,Economic
 자식 줄 바엔 그냥 팔래  주택 증여 확 줄었다 왜 ,Economic
최초  냉장고 남자모델 은 누구  그때 그 광고로 보는 삼성    이야기   노우리의 플러그인 ,Economic
몸값  조에 들썩    개미들  따따상 가자  대박 노리는 공모주들,Economic
 차라리 팔겠다  증여 대신 매매,Economic
중도금 대출 문 턱 높이는 은행에 저축은행으로 몰렸다,Economic
 증여 대신 판다  전국 주택 증여 비중  년 개월 만에 최저,Economic
 시승기     뉴  시리즈  게임 같은 핸들링  역대급 귀환  이제  시리즈까지 넘본다,Economic
 탄소장벽 에 갇힐 판인데  원전 품고  한국형        외치는 정부,Economic
 깡통주택   곳 중  곳은 전세보증금 못돌려줬다,Economic
상업용 부동산 투자   운영 이 중요한 때가 왔다  한경부동산밸류업센터 ,Economic
이자에 고물가까지  먹고 죽을 돈도 없다 ,Economic
금융당국 국감  라임 특혜 환매 대규모 금융사고 등 쟁점 전망,Economic
 무조건 정년연장  퇴직해도 조합원 하겠다는 현대차 노조  배성수의 다다  선 ,Economic
악재 한 번에 반영된 증시     선 후퇴 가능성도  주간전망 ,Economic
미국의    반도체 추가 규제에  큰 손 들마저 발 동동 중국 힘만 키운다   김민지의 칩만사  ,Economic
 세무상담   집 지분  찔끔 상속 받아도 다주택자로 볼까,Economic
  전자   상고하저  깨고 또 역대급 실적 올린다,Economic
생산량 감소에 쌀값 폭락 가능성도  뚝  포대당   만원 유지될까,Economic
적금 매달 꼬박꼬박 넣을 필요 없다고  오늘의 머니 팁 ,Economic
 공모주달력 구주매출  오버행 이슈  초대어  서울보증 수요예측,Economic
 증시 풍향계  지속되는 고금리 우려 속  펀더멘털도 보자 ,Economic
  나노서      역전했던 삼성 왜 밀렸을까  테크토크 ,Economic
 채권이         국채 쇼크에도   고금리 채권 베팅하는 개미들,Economic
 베이징 다이어리  탕후루는 어디에서 왔을까,Economic
 청약 포기할게요    기 신도시 지연에 사전청약 당첨자  이탈 ,Economic
 콕 건강  건강 적신호  비만 치료해야,Economic
 더 내고 더 늦게 받나   국민연금개혁안 최종 담판,Economic
 분기 전기요금 결정  이달 말 가능성    원   인상 필요  세종백블 ,Economic
 미 금리인상 끝났다 나스닥 담을 때 됐다   차은지의 리치리치 ,Economic
위험에 처한 참새를 구했더니  친화력 대박 ,Economic
 세종대왕  밀어낸  신사임당  축의금 용돈도  만원권 대세,Economic
 정쟁의 도가니 에서도 밥연기는 피어오른다 회사의맛 ,Economic
 고가 주택 찾는 자산가 많네  신축 고급 주택 희소성 ,Economic
 주주와 성과 공유  개미는 모르는    년 배당주  한국석유  윤현주의   이 주식 ,Economic
서학개미  월에만     억 넘게 사들였는데 기술주 하락에  눈물   투자    ,Economic
수출 효자  자동차     전기차 수출  년 만에   배 증가 세쓸통 ,Economic
내년부터 부부 동시에 특공 넣는다 특공 가이드   내돈내산 ,Economic
   세  여의도 시범아파트  드디어 재건축 가나요  ,Economic
 노점 줄 서고 올리브영 북적 사람 꽉 찼어도 유커 기다리는 명동,Economic
     바람  타고  전기차 배터리 한국상륙 수입      급증,Economic
 전력도매가 상한제   개월 시행에 한전   조 천억원 아꼈다,Economic
 뉴욕증시 주간전망  물가상승률 둔화할까     주목,Economic
 한달 전엔 황제주였는데  에코프로   개미의 변심    만원선도 깨지나,Economic
 분기 전기요금  국감 이후 내달 초중순 결정 유력,Economic
  대  강동 줍줍 아파트 무더기 계약 포기 나홀로   평이  억대라니  부동산    ,Economic
칼 빼든 보건복지부   병원 쏠림  더는 없다,Economic
 반도체 시장 선행지표   램 현물가 반등 한달새      올라,Economic
서울 병원도  빈익빈 부익부   의협  대학병원 수도권 분원에  지역의료 붕괴 ,Economic
초전도체 투자자 거의다 물렸다 손실투자자 비율  덕성     서남      투자    ,Economic
 중국판       나올까  막았더니 순익  배 된 회사들  차이나는 중국 ,Economic
또 한전채 한도 초과 비상  전기요금   원   인상 필요 ,Economic
 르포   급한 김에 고시원이라도    병원 찾아 삼만리  신촌 한달 숙박에만    만원,Economic
일용직 근로자 연평균 소득    만원   명 중  명 월    만원 안돼,Economic
구본무의 유산  억 천만원짜리 시계    트윈스 누구 품에 안길까,Economic
 년만에 최대폭 상승 주담대 증가세 이례적,Economic
람보르기니  인터넷 주소 내놔      테네시주 자동차 딜러 상대로 소송,Economic
유튜버 열풍 탄 휴대용     얼어붙은 낸드 시장  돌파구 ,Economic
세액공제 받으려면  공시 하라  어째서 노조만  김용훈의 먹고사니즘 ,Economic
전세보증 사고 폭증 올해만  조원 육박할 듯 전세사기 상처  ,Economic
 아시아나 빈 자리 노린다   항공화물 춘추전국시대 열리나,Economic
집주인 대신    가 갚아준 보증금  올해  조 넘어 전세사기  상처   ,Economic
광명 분양가  또  평당     만원 훌쩍        억원대 굳히기 ,Economic
 대은행 주담대  년만에 최대폭 뛰어 당국 은행 매주 점검회의,Economic
  나왔다  새옷 입은     대표 세단       시리즈 혼다 어코드,Economic
다가온 노량진 뉴타운  천지개벽   구역도  부능선 넘었다,Economic
 여행자는 수두룩  주가는 후드득  고유가 고환율에 발목 잡힌 항공주,Economic
 하드머니  손 대는 청년들  슬기로운 금융생활 ,Economic
노량진 고시촌 옛말     가구 아파트촌  상전벽해  임박,Economic
강남 구 아파트값 상승 여파  강북 중랑 등 외곽도  들썩 ,Economic
로또     회 당첨번호 조회   고꾸라진 서울 경기 자동 배출 ,Economic
 정래연의 요리조리  김치찌개에 참치는 못 참지    국민요리템  참치캔  넌 어째서 동원됐니 ,Economic
 이자 더 받을래  고금리예금 눈치싸움에  대은행  대기자금     조 넘어,Economic
  내륙지방 덕에  세계의 공장  지속한다    인도 멕시코 베트남보다 낫다 ,Economic
   망 투자  이래서 안 했구나  텅 빈  가짜     안 되려면 ,Economic
 비즈토크 하    햄버거 이어 로봇까지    한화  남  김동선  주목 ,Economic
매각명령 상상인 계열 저축은행  새 주인 찾기 순항할까 ,Economic
 비즈토크 상    따상 실패  두산로보틱스  우상향 전망 이유는  ,Economic
찬바람 부는데 교통비 이어 에너지요금 오르나   경제대기권 ,Economic
사전예약 시작 아이폰   폴더블 천만대 목표 삼성과 맞짱  누가 이길까,Economic
    회 로또 복권  등   명 당첨금 각   억     만 원씩,Economic
로또     회 당첨번호 조회     등   명 중 무려 자동   명 ,Economic
배당주의 계절       톡 ,Economic
나도  억  소리나는 유튜버나 해볼까     연소득 평균    만원,Economic
 포기하니 더 잘 커요  첫째때  유난맘 이었던 나  둘째부터  쿨한맘   워킹맘의 생존육아 ,Economic
너도나도 유튜버  상위   만  억소리  소득 쏠림 현상 가속,Economic
 싸지도 않은데 글씨체 마케팅만 해  배민이  이 나라 서 실패한 까닭  신짜오 베트남 ,Economic
     만명이 댓글조작  시진핑 호위무사들의 섬뜩한 여론전  조아라의          ,Economic
인분 소변에 이어 또 이번엔 새 아파트 천장서 이것 나왔다,Economic
테슬라  모델  모델  가격      또 인하   왜 자꾸 내릴까,Economic
도로  육만전자   분기 실적 업고 반등 할까,Economic
한화로보틱스 출범에 숨겨진 속내,Economic
   년간 이웃집 전기료 납부  계량기 바꿔 단 한전  당사자끼리 합의 ,Economic
 디지털화폐 도입하면 빅브라더 시대온다    한은 거래내역 파악 불가능 ,Economic
 인당  억원씩 자사주 산 두산로보틱스 직원들  평가차익은 얼마 ,Economic
  억 받고 떠나는  카카오 대표님   내 돈 내놔  개미들 분노  박의명의 불개미 구조대 ,Economic
 여보  강남 입성 내년으로 미뤄야겠어  공사비  분상제에 역대급 분양 가뭄  부동산    ,Economic
신축아파트 인분 이어 벌레 들끓어 천장에는 썩은 샌드위치,Economic
젓가락 안왔으니 환불해달라는 손님 그런데 음식 회수는 싫다고 ,Economic
 아들은   살   세 손주에 아파트 물려줍니다   부동산 아토즈 ,Economic
신제품 고프로   사용기  배터리 효율  세로모드         김범수의 소비만상 ,Economic
 코로나 특수  끝난지 오랜데 또 장삿 속   내장객   만 명 줄어도 옛 생각   외면할 수 밖에,Economic
 약점 폭로하겠다  연예인 협박해 수억 뜯은 김용호 구속영장 청구,Economic
블랙핑크 재계약 논란에 출렁  엔터 의 민망한 고질병   리즈 ,Economic
인테리어  현금결제시 할인  세금 득실 따져야 돈세지 ,Economic
 뒷북경제  생산   개월  최대 증가 정부  상저하고  전망 실현될까,Economic
목동이 양을 치던 들판  목동 땅의 이름은 ,Economic
 다들 너무 관심 없다  퇴직연금 수익률 높인다더니  빈수레 디폴트옵션  ,Economic
  만원으로 소맥 못 먹나  출고가 인상에 식당가  눈치게임 ,Economic
 대 금융사 수장들 국감기간중 모두 외유   횡령사고 등 내부통제  질타 불편한가,Economic
 운명의   월  맞이한 올리브영  왕관의 진짜 무게는,Economic
