titles,category
 위고비 삭센다  비만 약의 배신  위장 질환 부작용 우려 ,Culture
 서 고전하는 베이징현대  충칭공장 매각 희망가     ,Culture
 소래교회 초대 담임은 캐나다인  한인교회가 알린다,Culture
  시 날씨  저녁부터 중부지방 비 내일 맑아져,Culture
직격탄 맞은 성지순례   화약고  중동 평화위해 기도를 ,Culture
 오한과 발열   코로나 부작용 아니라  항체 생성 반응 이다,Culture
 간토대지진 학살  모리 감독  저항으로 역사진실 아는게 중요 ,Culture
 날씨  완연한 가을  큰 일교차 주의 오늘 밤 중부 한때 비,Culture
    년 전 일본 간사이는 한반도 선조들의 동네였다,Culture
폐경 전   세 미만 여성  당뇨병 진단 기준 더 엄격해야,Culture
 아빠  교회 캠핑 같이가요  무교 아버지  영접기도문 읊다,Culture
객석에 유령이    관객     명 가면 쓰고    회 공연 환호,Culture
 운동 많이 하는 사람일수록 덜 움직인다    이 무슨 말 ,Culture
 날씨  늦은 오후부터 중부 비   내일은  청명한 가을 ,Culture
 갑자기 빛이 번쩍  알게 모르게 시력 빼앗는 눈질환은 ,Culture
먹고 뛰면 생기는  옆구리 통증   대체 원인 뭘까 ,Culture
가을 캠핑 계획 중이라면   이것  주의해야,Culture
 날씨  한글날 중부 곳곳 비   도 이상 큰 일교차 주의,Culture
 퇴행성관절염  막는 연골 보호  근육 강화 운동법은 ,Culture
아름답고도 슬픈 역사 담긴 잔 다르크의 도시 루앙에 가다  최현태 기자의 여행홀릭 ,Culture
 세계  위  현대차로 우뚝   퍼스트무버  정의선 혁신 통했다,Culture
낮엔 품고 밤엔 베고 자면서 지켜낸 이 보물,Culture
이스라엘에 갇힌  교회들  우리가 할 수 있는 건 기도뿐 ,Culture
현대차  법인  충칭공장 매각가     인하,Culture
 뉴스초점  최고의 문화유산  한글  신조어  세종대왕 노하실까 ,Culture
강원 영서 영동  경북 북부에 내일까지 비  당분간 평년 기온,Culture
연휴 마지막밤  수도권 돌풍 천둥 번개에 비까지 일부선 우박도,Culture
 김용삼의 근대사  조선 봉건시스템의 변화,Culture
혈압 낮추고 살도 빼는 효율 높은 생활 습관은 ,Culture
 가을 태풍  볼라벤 발생 괌서 일본 해상으로 북진,Culture
 오후날씨 꿀팁  한글날  중부 비 내일  점차 맑아져요,Culture
단순 두통인줄 알았는데 뇌출혈   이렇게  구분하라,Culture
온종합병원  유방암 수술 명의  영입 센터 개설,Culture
 이번이 마지막  급하게 주문했더니 홈쇼핑에 깜빡 속았다,Culture
내 몸 안에  도둑 이 산다고  올해도    만명에 침투했다  생활 속 건강      ,Culture
 날씨  전국 흐리고 중부 중심 비 해안가 너울성 파도 주의,Culture
태풍  볼라벤 의 악몽 재현되나 한반도 영향은,Culture
나도 비타민  결핍일까  ,Culture
 오후날씨 꿀팁  한글날  중부 밤까지 비,Culture
 모빌리티 빅뱅    운전자 없는  레벨   자율주행 시대 열린다   기업 도전장,Culture
직장인      부부 공동 육아휴직 자유롭게 못 써 ,Culture
 코로나 백신 접종 후 오한 발열  더 많은 항체 생성되고 있는 것 ,Culture
 오늘도 만졌는데  암 부를 수 있는  이 습관 ,Culture
일시적인 줄 알았는데  주 지나도 수면리듬 회복 안되면 불면증,Culture
 올해는 김장 포기할까 했는데   마트 가서 가격보고 마음 바꿨다,Culture
 굿샷보다 인증샷  외치던 골린이들 떠나자 이 골프웨어 뜬다는데,Culture
  년 목회자도 성경적   신천지 서울 말씀 대성회  성료,Culture
 날씨  전국 흐리고 중부 중심 비 돌풍 벼락 동반 요란,Culture
우울증 환자    만 시대   그런데  통계의 함정 이라고   메디노트 ,Culture
 약손   폐암의 진단과 치료  기관지 내시경 검사,Culture
영단어 알아도 한글은 모르는 아이들  심각합니다,Culture
배고프다면서  밥  말고  술  찾는 사람   왜 ,Culture
가을바람 솔솔  우리  숲멍  하러 가요,Culture
억울한 감정 참으면 진짜 병 된다  한의사의 화병 조절 방법,Culture
 고맙다  하이브리드  렉서스 판매  년 만에   배 로,Culture
솔비 명세빈 장도연도 했다   미혼   난자 동결  급증,Culture
     날씨  한글날  중부에 늦은 오후부터 비 높은 너울 주의,Culture
    대원의  감 이 생명 살렸다  돌연사 위험  이 증상 은 ,Culture
 날씨  한글날 중부 중심 비 곳곳 돌풍 우박 주의,Culture
사라진     라인을 찾아서  다시마면 비빔국수 레시피  굿바이독소 ,Culture
주행만 하는 당신  전기차 절반만 쓰는 겁니다,Culture
 시속      폭주  못 피해가는 급발진 논란,Culture
다이어트 포기 부르는 국내 골목여행지  입과 눈까지 즐겁다 ,Culture
전기차는 탄소배출      기름차 절반은 발생,Culture
 혈당 관리에 탄수화물은 적   오해는 이제 그만   식탐 ,Culture
동해바다 코리안라군   칸 고택의 앙상블  꽉찬 문화유산 여행,Culture
    년 한반도 덮쳤던  볼라벤  또 생겼다 북진 중,Culture
 날씨  한글날  중부 오후 늦게부터 비   남부 흐리고 선선,Culture
약탈해간 고려불화가 식민 잔재  반도 미술 이라고 ,Culture
전기차 시장의 둔화   미래는 달라지지 않는다 ,Culture
비염 있는 사람   이곳 에서 귀 잘 먹먹해지는 이유가 있다,Culture
자기전에  와사삭   숙면  이것만 먹어도 됩니다,Culture
 출근길 날씨  늦은 오후부터 중부지방 비 돌풍 벼락 우박 주의,Culture
 날씨  오후 밤 중부 비 당분간 큰 일교차 계속,Culture
 날씨  종일 흐림 늦은 오후부터 밤사이 중부 한때  비 ,Culture
공포의 태풍  볼라벤  또 생겼다 한반도 영향 가능성은,Culture
 창피해서 못타겠다  돈없는   대는 싫다는 경차  회장도 엄빠도 반했다  세상만  ,Culture
가해자가 사라져도 남아있는 폭력의 굴레 연극  지상의 여자들 ,Culture
 김경래의 마을 땅 집  일반 주택 건축물 건설땐 농지전용 개발행위 허가 받아야,Culture
 지방소멸에 맞서다    말 소 키우던 제주 목장이 우주산업 터전으로,Culture
귤 안 까고도 알맹이 개수 아는 법,Culture
 출근길 날씨  늦은 오후부터 중부지방 비 돌풍 벼락 우박 주의,Culture
 묵직하고 찌릿한  허리 통증  도대체 무슨 원인일까 ,Culture
가공식품 외식 과일값도 치솟는다,Culture
단종되는 캠리  맥 못 추는 쏘나타 멸종 위기 맞은  글로벌 세단 ,Culture
명절에 받은 통조림     개봉하며 빨리 먹어야 ,Culture
 카드뉴스      년   월   일 오늘의 운세,Culture
쌀쌀해지는 날씨  중년 남성 더 조심해야 되는 이유 ,Culture
한글날 오후 중부지방 최대     비 수도권 천둥 번개 오늘날씨 ,Culture
가을 제철 고구마   이렇게  조리해야 영양분 안 놓친다,Culture
 더사주 오늘의 띠별 운세     월  일 월요일 음력  월  일  ,Culture
 박종순 목사의 신앙상담  출석 교회 한 권사님의 말 때문에 주변 사람들이 상처 받는데,Culture
 지피지기면 백전불태 당장 나라 구할 길 없어 답답하다 ,Culture
묘지 위에도 판잣집 뚝딱 피란수도 곳곳 필사적 생존 흔적,Culture
윤여정  오스카상 괜히 받았어  존경이란 말 무섭다 ,Culture
젊어도 난임일 수 있다 난자냉동 한다면 최적 나이는   건강한 가족 ,Culture
 그 영화 어때  부산국제영화제 최고의 추천작  고레에다 히로카즈의 영화  괴물 ,Culture
노화인줄 알았는데  질병 의 신호인 증상들,Culture
    중형 세단 라인업 추가된 전기차  뉴         드라이브 ,Culture
 검정고무신 사태 가 계기  모든 장르 작가 권리보호 눈 뜨다  이슈 속으로 ,Culture
엄마 프사에만 숲    도 빠졌다   만 다녀간 경주 핫플,Culture
회사에서 스테디셀러로 살아가는 법,Culture
 뉴스  날씨  한글날  늦은 오후부터 중부에 비 높은 너울 주의,Culture
 스트레스가 암 재발률 높여  실제 위험 최초 확인,Culture
남미괴담이 내게로 왔다  그리고 벌어진 일  세계여행 식탁일기 ,Culture
역사의 도시는 여전히 역사 위에 서 있다  가자  서쪽으로 ,Culture
 날씨  내일 늦은 오후부터 중부 비 해안가 너울 주의,Culture
언덕많은 리스본  꼭 필요한 이것,Culture
코로나   백신 맞고 몸살기운 있으면 좋은 소식 ,Culture
   월 태풍    호 볼라벤 북상 중 한반도로 다가오나,Culture
여행하기 쉽지 않은 도시 나폴리  듣던 대로였다  가자  서쪽으로 ,Culture
 영상   젊은 여성 집중 납치 시신의 바다  하마스 기습공격 목격 증언,Culture
 강해 설교 종말을 맞이하는 성도   종말의 끝날,Culture
배에 만져지는 덩어리  알수록 빨리 보이는  간암 신호들 ,Culture
건강백년길을 걸었더니     살까지 건강하게 살 것 같네,Culture
심장이 갑자기  콩닥콩닥   심방세동  뇌졸중 위험  배 높아져,Culture
덴마크 인생학교에서 세종대왕님을 찬양하다 ,Culture
그림  백작 부인의 죽음 이 보여준 중요한 사실,Culture
흐리고 비오는 한글날   돌풍에 천둥 번개까지,Culture
 디깅 트래블 수라상 오르던 김 항암효과 인정받은 새우젓 한자리에,Culture
  호 태풍  볼라벤  발생  가을 태풍 한반도 상륙할까,Culture
아무리 노력해도 빠지지 않는 살  문제가 뭘까 ,Culture
주사 한 방에  억     만 원인데       는 효과 못 봤다 ,Culture
태풍 볼라벤 북진 중     년 이래    월 태풍  없었는데  경로는,Culture
 수입 전기차  믿을 수 있나  국내 전기차  만 천대  배터리 상태 진단 불가     대중  대가 수입차,Culture
내일 늦은 오후부터 중부에 비 높은 너울 주의   시 날씨 ,Culture
 날씨  한글날 중북부 약한  비  내륙 중심 큰 일교차,Culture
   년만에 복원된 광화문 월대    일 공개,Culture
  한 방에  억  주사  효과 있었습니까     명 중  명  이렇게  답했다,Culture
가을 태풍 한반도 상륙하나   호  볼라벤  괌 근처서 발생,Culture
 평화를 주옵소서   세계 교회  이스라엘 하마스 전쟁 종식 기도 요청,Culture
 건강메신저 메디      난청 방치하면 우울증 치매 위험 커진다,Culture
 음악으로 아픔 이겨내     류마티스 환자와 의료진 위로한  관절가요제 ,Culture
 하나님 앞에 가게 되더라 딸을 통해 나눔 계속될 것 ,Culture
   피해자들  정명석  재판 의도적 지연시켜  차 가해 가중 ,Culture
여성 갱년기의 가장 위험한 후유증  가지  이유는 ,Culture
국가열등감의 출발점  여기서부터 아닐까 ,Culture
 버섯정류장  존재감 뿜뿜  먼지버섯 을 아시나요 ,Culture
 날씨  전국 흐리고 선선 한글날 중북부  비 ,Culture
폭격 맞은 성지순례지 이스라엘 관광부    관광객 피해 없어 ,Culture
비행기 뜨기 직전  저 내려주세요      건이 이것 때문,Culture
 단독  걷기만 했는데   억원 쌓였네 오세훈도 우유 사먹었다는데,Culture
 날씨  절기 한로  선선한 날씨 낮까지 곳곳  비 ,Culture
고전문구 수집했을 뿐인데     친환경  맞을까 ,Culture
 가족   수줍음 있지만 따뜻한 마음      형 믹스견  얼 ,Culture
 그립습니다  문기명 씨의 아버지 고 문종열 씨,Culture
한강 불꽃에    남자축구 야구 금메달 편의점 맥주도 대박,Culture
학부모 교사 학생  누가 진짜 괴물인가   고레에다 신작  괴물 ,Culture
내일 중부지방 가을비  당분간 일교차 큰 날씨,Culture
어르신 국가무료 독감예방접종  오는   일부터 순차 시행,Culture
연휴 이후  급찐살  충격   그래도 피자 라면 먹고싶다면,Culture
한강 경주 강동구 드라마 안내 따라 팔도유람 어때요 ,Culture
술 마신 뒤 소변보다  휘청    이것  때문이었다,Culture
 세 때 몸    불타 얼굴없는 아이      세에 경찰관 꿈 이뤄 ,Culture
 날씨  낮까지 제주 등 일부 지역  비  해안가 강한 너울,Culture
밀크플레이션  현실됐네   우유값 오르니 이것까지 줄줄이,Culture
출산지원금 늘린다고 아이 낳을까요 ,Culture
완전한 암흑으로 작품성 시장성 대중성 거머쥐다 ,Culture
빵 먹을 때 주스 먹지 말라고    궁합 안 맞는 음식 조합,Culture
 날씨  흐리고 선선 낮까지 해안가 등 곳곳  약한 비 ,Culture
사과 배에 누런 얼룩이 꿀이라던데  진실은   주방 속 과학 ,Culture
 무균의 자궁 태반과 오염된 여성    허스트베트  어머니의 기원  책에서 건진 문단 ,Culture
어린이집에 보내는 게 좋을까  집에서 키우는 게 좋을까  책마을 ,Culture
잠 잘 자고  껌 씹는 게 가을 식욕 누르는 법 ,Culture
콩자반 파 자주 먹었더니  지방 모발에 변화가 ,Culture
청주 세종 대전    분 생활권  묶는다는데 속도내는 충청권 광역철도  방방콕콕 ,Culture
 씨네멘터리  후반전을  달리는  주윤발의  인생본색 ,Culture
건강식품  매일 똑같이 먹었더니 이런 일이   식탐 ,Culture
 약손   폐암의 진단과 치료  폐암 검진에 대한 오해와 진실,Culture
  호 태풍  볼라벤  발생    월인데 태풍올까 ,Culture
우울증 환자    주 약 복용    달리기 효과는 ,Culture
 중국산 테슬라  얼마나 싸길래 벤츠  클래스도 제쳤다  최수진의 나우앤카 ,Culture
 가을철 독감  노인에게 치명적일 수 있다 ,Culture
 환상극장  글 쓰는 기계 류광억의 존엄한 죽음,Culture
저혈당 환자 살린 경찰의 콜라  제로음료도 괜찮을까   살아남기 ,Culture
 뇌가 다 망가져요  경각심 갖고 봐야 할 수면 방해 행동  머니 클라스 ,Culture
 날씨  절기 한로  완연한 가을 날씨 동해안 남부 곳곳 비,Culture
 이주신차       아이코닉 세단  뉴  시리즈    최초 출시,Culture
피부에  이것  생겼다면    심혈관 질환 주의하세요 ,Culture
    파업에   완성차  빅   휘청      기업  반사이익  가시권,Culture
 화엄문화제  꽃스님과 걷고  음악회도 보고  절로 행복해요 ,Culture
하루에도 몇 번씩 괜스레 울적하고 눈물이 나는데 ,Culture
 내일날씨  한글날 전국 흐려 일부 늦은 오후 비,Culture
 리빙톡  어느 날 갑자기 변한 목소리     이라고 ,Culture
예술의전당 깜짝 방문 한동훈 장관  대박 ,Culture
 책 한 모금  밥 먹고 가라  섬마을 인심 뭘 먹었나 보니,Culture
임신 중 호르몬 변화  모성애 촉발한다  연구 ,Culture
한국에 마음 놔뒀다는 마가렛  시신도 주고 떠났다,Culture
 날씨   한로  영동 남부 제주 비 조금   선선한 가을 날씨,Culture
중국산 배터리가  대세   수입      급증,Culture
뇌가 보내는 위험신호 놓치지 마라 암보다 더 두려운 이 병  건강한 가족 ,Culture
대체  사경 이 뭐길래 화장실 갔다오면  향수 목욕  해야 했을까 이기환의          ,Culture
 이 영양소  굳이 영양제 필요 없어  식사로 섭취하면 충분,Culture
윗배 부여잡고 바닥 뒹굴  생존율     혁명가 쓰러뜨린  이 병 ,Culture
 타볼레오 기본기 갖춘 혼다      과거 영광 재현할 수 있을까,Culture
 짱구 엄마  암 투병 고백  시한부  년 선고받고 수술 ,Culture
 뇌 속 노폐물 잘 빠져나가    림프 마사지로 치매 예방,Culture
 나는 솔로  홀딱 벗겨 광장에 세워라  독신자 공개모욕 준 나라  사색     ,Culture
과연  귀하의 노고에 감사드립니다 에는 무슨 의미가   북적북적 ,Culture
감히  경차값 에     팔다니   천만원대  하극상  건방진데 비교불가  카슐랭 ,Culture
갑자기 뚝 떨어진 기온에 편의점 호빵 어묵  불티 ,Culture
 우리 할머니 턱걸이 잘하죠     대  탄탄한 복근의 비결,Culture
  시 날씨  절기  한로   낮까지 영동 남부 비,Culture
 차라리 내가 사장한다  퇴사  년 만에       버는 비결  방준식의  잡 시대 ,Culture
 모기    번 물린 것 같은 고통   만성 두드러기 환자  좋은 약 있어도 못 쓴다,Culture
깻잎에 난  솜털 의 정체  깻잎 박사에게 물었다,Culture
제대로  걷기 만 해도  살 빠지고 체형 바뀐다,Culture
교황이 따귀를 맞으며 시작됐다  아픈만큼 성숙해진  와인  김기정의 와인클럽 ,Culture
전기차 판매  둔화세  국면 복잡해진 업계 셈법,Culture
국내 암  위  췌장암  초기 발견 어려워 금연 중요,Culture
    세건강  환절기 불청객 가려움증 작은 습관 교정이 삶의 질 바꾼다,Culture
부자인 걸 숨기려  가난한 결혼식 을 꾸몄던 부잣집 따님      ,Culture
찬 이슬 맺히는  한로  큰 일교차 주의 제주 최고     비 오늘날씨 ,Culture
 이상현의 카                     특별함으로 소비자 겨냥한  ,Culture
중년에 근육 유지하려면    단백질 많은 식품은 ,Culture
 주린이   틀딱   매춘   좌좀 에 숨어있는  차별 을 발견하다 프레시안       ,Culture
 헬스   여성이 남성보다  배 더 많이 걸리는 자가면역질환은 ,Culture
  억    만원씩 받는     회 로또  등 주인공   명  당첨명당 어디 ,Culture
 팩트체크  맨발 걷기  정말로 건강에 효과 있을까 ,Culture
 박수현의 꽃  가을 들녘 뚱딴지,Culture
 인플루언서 프리즘   나도 한 번 따라해 볼까   맨몸 운동  콘텐츠 인기,Culture
 아하   판사님  여성도 군대에 가야할까요   영상 ,Culture
 주말엔 운동  과음 다음 날 운동 쉬는 게 좋을까  하는 게 좋을까 ,Culture
 주말엔 음식  찬 이슬 맺히는 한로      이 음식으로 건강 챙기자,Culture
본고장에서 빚은        인절미 한국기록 등재,Culture
 뉴스  날씨  내일까지 동해안 남해안 제주 비 해안가 너울 주의,Culture
 이사부 장군이 우산국 정복한 날을 독도의 날로 ,Culture
입 속  이것  안 사라지면 암 의심,Culture
헌혈하면 살 빠진다  헌혈에 관한 진실 혹은 거짓,Culture
 샤워하긴 귀찮아서  허리 숙이고 머리 감으면 건강에  악영향  왜 ,Culture
찬 이슬 맺힌다는 한로  일 일요일 중부 구름 남부 비,Culture
식사  이렇게 하면 중증 저혈당 위험  배 오른다,Culture
 날씨  휴일 흐린 하늘   큰 일교차 주의,Culture
유인촌 장관  현충원 참배  문화로 국민들에게 희망과 위로를 ,Culture
 날씨  완연한 가을 날씨 일요일까지  오락가락  비 소식,Culture
꼬리에 꼬리를 무는 최초의 술 역사  명욱의 술 인문학 ,Culture
   초만에 감별     신체 기관이 보내는 질병신호들,Culture
 날씨  구름 낀 한로 영동 남해안 가을비,Culture
 쉬운 말을 쓰지 않는 게 차별  언어는 인권이다 ,Culture
 여기가 관람 명당  서울 여의도 불꽃축제  어디서 볼까 ,Culture
놓치면 나만 손해  맛과 영양 모두 잡은 제철음식 ,Culture
 전동마사지기로 턱뼈를 부숴라     갸름한 턱 원해서  왜 이러나 ,Culture
 양치    법칙 틀렸다     충치 폭탄 맞는 최악의 습관들,Culture
 날씨  내일도 흐린 하늘   해안가 강풍 주의,Culture
  호 태풍 볼라벤 발생  괌 관통해 한 일 향해 북서진 못 미쳐 북동진 꺾나  ,Culture
전세계    만명이 봤다  흘러내리는 태극기  뭐기에 ,Culture
 날씨  해 지면 쌀쌀  일교차 주의 내일까지 동 남해안 제주 비,Culture
유인촌    임명 뒤 현충원 찾았다 방명록에 남긴 글 보니,Culture
 생소하네  배에도  편두통 이 온다  어떻게 ,Culture
자전거 부르는 가을 날씨 전립샘 걱정되는 남성의 꿀팁  건강한 가족 ,Culture
한강에서 배달음식 이제 안 된다고  암호명     ,Culture
유인촌 문체부 장관  현충원 참배  문화로 희망과 위로를 ,Culture
  세 이하 여성   혈당 관리가 특히 중요한 이유 ,Culture
 배달앱도 일시 중단  서울 여의도 불꽃축제  교통 통제 구간 어디 ,Culture
   한국어능력시험 위해  사업가 로 변신한     아나운서,Culture
 단독  솜방망이 처분에  불법  음식물분쇄기 버젓이,Culture
천하의 이정후도 방심하다 당했다 사람 뼈 절반 몰린  이곳    재활 명의  나영무의 진담 ,Culture
 날씨  대체로 흐림   내일까지 동 남해안 비,Culture
 날씨  주말 큰 일교차 유의 내일까지 해안 제주 가을비,Culture
대장암  년 시한부 선고  짱구 엄마  항암 투혼 알려졌다,Culture
꽃구경에 전통음식 맛보기까지 전국 곳곳서 가을축제 만끽,Culture
남편 생일  막내 사위가 미역국을 끓였다,Culture
 커피  탓에 병원 응급실과 접수처가 모두 닫혔다  커피로 맛보는 역사  역사로 배우는 커피 ,Culture
내년부터 미국서 전기차 살 때 보조금 혜택 바로 받는다,Culture
  년 살겠네요   짱구 엄마  암투병 사실 공개,Culture
 날씨  주말 한낮 선선  일교차 유의 해안 제주 곳곳 비,Culture
저우룬파  이런 얘기까지 다루나  한국 영화 경쟁력은 자유 ,Culture
돈  메뉴판  키오스크   만진 손 바로 씻으세요,Culture
불꽃축제    만명 오늘 여의도  이 서비스  제한된다,Culture
무려        자전거 여행  이동 경로가  하트 모양   감동 사연은 ,Culture
 최민식 박보검 도 못 나와 창고에 쌓인 한국영화  충격   김소연의 엔터비즈 ,Culture
이영표 한일전 축구 결승 예측  내 말 틀렸으면  ,Culture
 슬기로운 서평생활   미운 오리 새끼 가 아니라  미운 새끼 오리 였다면,Culture
   도 안 되는데  새끼 낳는 도구였던 작은 개 가족의 발견    ,Culture
 날씨  주말 큰 일교차  한낮 선선 동 남해안 제주 비,Culture
은쟁반에 배달된 백반의 추억  맛에 감성을 더하다  김동기 셰프의 한그릇 ,Culture
운동할 때마다 가려워 미치겠어요  세상에 무슨 일 ,Culture
 어릴적 운동  평생 갑니다  육상부 출신 서울교대생의  건강하게 공부하는 비법  양종구의    세 시대 건강법 ,Culture
 장기기증  남편 기억하며 나눔의 삶 이어가는 유가족,Culture
 이자   야  판매량  배 뛴 쏘렌토 싼타페  도심 아웃도어  공존전략 적중,Culture
시골에선 누구나 맥가이버가 된다,Culture
 이건 몰랐죠     마늘 입냄새 싹 날리는 과일은 ,Culture
저출생의 원인  돈보다  이게  더 문제입니다,Culture
 혈압약을 평생    이럴 땐  먹다가 끊어도 된다 한 장으로 보는 건강 ,Culture
 날씨  큰 일교차 계속   연휴 날씨는 ,Culture
 날씨    도 안팎 큰 일교차 오후 동해안 남해안 비,Culture
    년 이곳엔  노키즈존  없습니다  출산율이  명이니까요   씨네프레소 ,Culture
한겨울 수준  독감 폭증세 심상찮다     폐렴 생기면 위험 ,Culture
원목 도마  어떤 목재 오일 쓰느냐보다 관리가 더 중요 김기자의 주말 목공 ,Culture
한국 종가 자부심 이어줄   별 정자은행 생긴다면,Culture
 약손   폐암의 진단과 치료  폐암 병기구분,Culture
 대장암 수술 받으면서 녹음   짱구엄마  성우 강희선의 투혼,Culture
 주말엔 건강  중장년층  비뇨기 증상으로 괴롭다,Culture
 혐의 인정 뒤에도 계속 악플  가수 이찬원  차 고소,Culture
백내장 수술 효과 보려면 보험보다  이것  먼저 확인해야,Culture
감기에 좋은 갈근탕 재료가 이거였구나,Culture
중부지방 맑고 가끔 구름 오후 영동 남해안 제주 비,Culture
 유부녀와   년간 알몸 밀회    뒤흔든  스캔들  전말  성수영의 그때 그 사람들 ,Culture
대장암 못 낫게 하는  분자  발견   없애면 치료 수월,Culture
 타볼레오 차덕후는 알아본다 아이오닉  의 진가를,Culture
보이는 모든 것이 아름답다  공동묘지까지도      ,Culture
억새꽃 보고 자전거 타고 한강부터 공원까지 축제로 물들다 서울해요 ,Culture
 책 한 모금   년 간 새벽  시에 일어났더니 ,Culture
절기상  한로  제주 최고     비 큰 일교차  주의  내일날씨 ,Culture
 동면 준비  뱀  가을철 출몰 주의   만약 물렸다면 ,Culture
 부족하면 면역력 뚝   쌀쌀해지면 챙겨야 하는 영양소  식탐 ,Culture
밥 한 공기 뚝딱  찌개의 계절 주말  ,Culture
환절기 감기인 줄 알았는데  증상 비슷한  뇌수막염  일수도,Culture
 날씨  오늘도 큰 일교차 유의   영동 남해안 제주 비,Culture
제주 남해안에 늦은 오후부터  동해안에 밤부터 비,Culture
집에서 누워만 있으면 휴식  효과적인  주말 재충전  방법,Culture
동료와 땀 흘리며 자극도 팍팍 힘든 운동  함께라면 할 수 있어      ,Culture
 저는 포르셰입니다 로 자기소개 강력한 열쇳말로 시작하라,Culture
