titles,category
 정치톡톡  이재명 대표 전화왔습니다   친명계 와글와글   강서 재보궐     여야 총력,Politics
 단독     때 블랙리스트 없었다 는 유인촌 수사기록엔 국정원이 장관에  직보  정황,Politics
 단독  값비싼 요금제  전광훈 알뜰폰  딸 회사 수익 몰아주기 ,Politics
 아는기자 연말까지 강대강  출구 없는 여야 대치,Politics
  영장 기각 후 첫 시험대 민주   이균용 당론 부결  가닥,Politics
박정훈 전 단장 반박한 국방부 내부 문건 유출  군사법 심히 우려돼 ,Politics
 이  에  선 후퇴 요구  민주  사실 아냐  공식 확인,Politics
민주   이균용 부결  계속 거론  사법방해  역풍 우려도 종합 ,Politics
   앞세운    지역숙원 해결 강조    정권심판 내건    소속의원 총동원령  강서구청장 보선 ,Politics
김태우  검 경 대결  프레임일 뿐  구청장은 민생이 최우선   강서구청장 보선 ,Politics
이재명  당무 복귀 앞당겨지나  병상서 강서구청장 투표 독려,Politics
특목 자사고 진학생       서울 출신  국감 파일 ,Politics
친윤계  부산  보수 우세 선거구  몰릴까,Politics
서울 강서구청장 선거 사활  경 인 여야 의원  총출동 ,Politics
강서 보궐선거 전 복귀   리더십 시험대 선 이재명,Politics
   김정은 군함 건조 지시에   기술 도둑질 시도 국정원  대형조선업체 타깃 ,Politics
강서구청장 선거            정권 심판        지역 발전  정다운의 뉴스톡 ,Politics
여야  강 대 강 대치 속 최악 충돌은 피해,Politics
 정부 여당  중국 응원  호들갑  코미디가 따로 없다 ,Politics
김종인이 주식 권유  정치인 사칭하는  가짜 광고 ,Politics
민주  이균용 인준 여부  일 본회의 직전 의총서 결정키로,Politics
말 많은  이재명 단식 복귀 시점  리더십 시험대,Politics
 개   가     만 클릭  드루킹 재발 우려      침소봉대 ,Politics
   우리가 이영애 문제삼던가   김윤아 발언 신중  그 자체가 블랙리스트 ,Politics
민주   이균용 임명안  당론투표 여부 모레 본회의 직전 결정  종합 ,Politics
 김행 청문회  갈등 고조 여야  파행 기로에서 극적 협의 나선다,Politics
강서구청장 보궐선거  여야 총출동  서울시장 선거급  판 커져,Politics
 이준석에게 도움 요청도 그렇고     국민의힘  강서구      표심 걱정되네,Politics
홍익표   정부 독주 막겠다  강경 기조 김행 청문회는  일 개최할 듯,Politics
투표율    가 분수령    강서구청장 선거는 여야 지지층 결집 대결,Politics
 다음 서 한중전  응원     조작 논란에    수사해야     포털 협박 ,Politics
강서구청장 보궐선거 막판 총력전 패배 시 양당 지도부 책임론 불가피,Politics
내일 김행 유인촌 청문회   자격 공방에 진통 예고,Politics
대법원장 표결 장관 청문회  치열한   월  예고,Politics
민주   이균용 임명안  당론투표 여부 모레 본회의 날 결정 ,Politics
여야 원내대표   일 김행 청문회  정상 진행되도록 협의 ,Politics
고민정  김태우  건설업자에 골프 접대 받고 청와대 쫓겨난 비리 인사 ,Politics
민주당  인사청문특위 호소에도  이균용 부결  당론채택 불발,Politics
여야  내일 김행 청문회 정상화 협의 노력  윤재옥 홍익표 첫 만남,Politics
강서구청장 선거 사전투표      한정애  강서 이끌 진짜 일꾼은 진교훈 ,Politics
     해커  선거 개입할 수도   댓글 국적 표시법  속도낸다,Politics
대법원 읍소에도  민주  이균용 동의안  부결  여론몰이,Politics
금태섭  제 지대 신당 제 역할 못하면 내년 총선 민주당 앞서갈 것 ,Politics
 뉴스 댓글 과 다른데도  여론조작    트집 잡아 포털 때리는 정부 여당,Politics
파행 피한 김행 인사청문회    여야  정상 진행 협의 ,Politics
 국감 증인  신경전     정부 출신      정부 사람 ,Politics
내치면 분당  품으면 분열  이재명의     딜레마 ,Politics
한중전에 국민    가 중국 응원  정부  여론조작 의혹  포털 압박 이슈분석 ,Politics
민주   이균용 임명안 부결  당론 결론 못내  일 본회의 전 결정,Politics
김수현 전 정책실장   정부 집값 못잡아 대출 조였어야 ,Politics
민주당 지도부  고름   색출  가결파 압박에  고약하다  반발,Politics
이재명  이번주 보선 지원 유세 나설듯,Politics
여야  국방부 여가부 장관 청문회 놓고 대치 격화,Politics
용산  청년  행정관 총선 출마 가시화   청년 표심 기대      당내 갈등 우려 ,Politics
하태경  이재명 목표는 다음  대선  대법원장 후보자 부결  아슬아슬 ,Politics
   총선 전 포털 여론 조작에  발칵   선거 때도 벌어질 수 있어 ,Politics
대법원장 후보자   년 만에 낙마 위기   민주당   일 본회의 직전 결정,Politics
국방부 해병대 사건 반박 문건에  곡학아세 한심  비판론,Politics
 김미경의 정치네컷  이재명에 울고 웃는 여야,Politics
홍익표  김윤아 지적한 유인촌에  매우 부적절 우린 이영애 문제 삼지 않아 ,Politics
정무위  국감 증인 참고인   명 명단 우선 의결  금융    는 대거 제외,Politics
 윤심  업고 꽃길만  영남 향하는  용산 낙하산 에 고심 빠진  ,Politics
카페  알바생  군인 주문한 음료에 손글씨  위로 받았다 ,Politics
김행  주식 파킹  논란에  소셜뉴스 주식 재매입시기 인생서 지우고 싶어 ,Politics
 프레스룸        일개 법무부 장관 관심 없어  병상서 마이크 잡은 이재명 뉴플리 민지숙,Politics
   남북관계 걱정  우려에 남북연락사무소 폭파 재조명,Politics
 프랑켄슈타인 잠수함  비웃음 산 김정은   기술 도둑질 나섰다,Politics
국방부가 작성한  해병대수사단장 대응 내부 문건 보니 ,Politics
 유인촌  김윤아 언급이 블랙리스트 민주당은 이영애 문제 안 삼아 ,Politics
 메가톤급  파장 안겨줄 강서구청장 선거 최대 관건은  투표율 ,Politics
   다음  응원 조작에 매크로     사용 친민주 세력 악용 우려 ,Politics
   헌법에  핵무력 선언  후 여론전  당 창건일 위성 발사 임박,Politics
 이재명 무서운 사람   김재원    영장기각에  비명계  숙청 전망,Politics
이성윤  조국 만났다고 징계  수사 대상 조선일보 사주 만난 윤석열은  ,Politics
백지신탁 과거 발언   김행 여가부 장관 후보자 청문회 쟁점은,Politics
정무위  국감서  갑질  따진다   정몽규     회장 등 증인 소환,Politics
   유엔사 해체  종전선언 주장 등 가짜평화론이 활개치고 있다 ,Politics
강서구청장 선거판 키우는 민주당  판 줄이는 국민의힘,Politics
 청문회         김행 후보자 인청 정상개최 협의키로,Politics
   위성 재발사 예고한   월 러시아  원포인트 레슨  나설까,Politics
금태섭  제 지대 역할 못하면 내년 총선서 민주당 앞설 것 ,Politics
강서구청장 보궐선거 투표율      넘을까,Politics
윤 대통령  문재인 대북정책 비판  가짜평화론 활개 ,Politics
 여의도 번지  정기국회 일정 다시 시작 여야  현안마다 신경전,Politics
 남자 잘 만나야  회식자리서 성회롱 발언  하남시 동장 대기발령,Politics
 이균용 임명동의안  운명은 부결시 사법수장 장기 공백 불가피,Politics
강서구청장 보궐 사전투표     일   개 투표소서 진행,Politics
강서구청장 선거     민주당  선대위 확대하고 집중유세,Politics
 청문회 정국  여야 대치 신원식 보고서부터  불발 ,Politics
대통령실  총선 러시  본격화 하나 참모진 출사표 잇따라,Politics
고민정  비리범죄자 김태우  막말아이콘 유인촌  라인업 화려 ,Politics
 이용호   한동훈 탄핵   공세에  탄핵 대상은 유창훈 판사 ,Politics
 단독 정율성 흉상 훼손 인물은  조선공산당 창당대회 터  표석 훼손범,Politics
칼자루 쥐고 뜸들이는    이균용 당론채택  일로 미뤄,Politics
민주  대법원장 후보자  부결 당론    일 본회의 직전 결정 ,Politics
 뉴스        일주일 앞둔 강서구청장 선거  누가 웃을까 ,Politics
정무위  정몽규     회장 이선정   올리브영 대표 등 증인   명 채택,Politics
국힘  대한민국   괴뢰  표기한 북한에  버릇없는 금쪽이 ,Politics
 억울한 죽음 밝혀야     하남시   대 공무원 사망  왜 ,Politics
양당 싸움에 추경 묶인 성남 오산  지방의회는 이미  총선전 ,Politics
민주   이균용 임명안  당론투표 여부 모레 본회의 직전 결정 ,Politics
 구독자   만 유튜버  조민  성형수술 한 곳도 안해 정치엔 관심 없어 ,Politics
   이재명 향한   선 후퇴  요청 사실 아냐 ,Politics
주식 파킹 논란 김행  부끄러움 없어    내일 소상히 밝힌다 ,Politics
    년  월  일  김태우의  집 은 어디였나,Politics
유인촌  유명인 공개 표현 신중     홍익표  발언 자체  블랙리스트   앵커리포트 ,Politics
김기현  포괄적 차별금지법  내가 당에 몸 담는 한 절대로 통과 안돼 ,Politics
국방부  박정훈 대령 주장 조목조목  반박문건  작성  내부 회람용 ,Politics
 김행 청문회  불발 가능성까지 거론      사과 없으면 불참 ,Politics
민주당  박광온이 이재명  선 후퇴 요구  사실 아니다 ,Politics
추미애  결기 보인 이재명에게 어떻게    가결표 의원 스스로 용퇴하길 ,Politics
 청문회서 다 밝힐 것 이라던 김행  하루 전 불참 가능성 솔솔,Politics
김재원  이재명 복귀  피의 숙청  순위는 설훈 ,Politics
   년전 파독 위대한 한국인 산업사      역사로 챙겼다,Politics
 단독  기업규제 해소 청신호   민주  삼성 현대차 등 소원수리,Politics
 단독  정부 부처  곳 중  곳 청년보좌역은  여당  출신,Politics
여가부 장관 청문회 운명은     사과 먼저      무산 의도 ,Politics
국민의힘 총선 출마 도전자들  추석 맞아 현수막으로 존재감 드러내,Politics
민주  이균용 부결  기류에      의석 수 무기 힘자랑 ,Politics
중국 클릭 응원에  사회적 재앙  흥분한 정부 여당,Politics
 영수회담  각 세운      출구 없는 정국 갈등,Politics
박찬대  가결 전후 이재명 내려오게끔 행동한 분들  해당 행위  조치 필요 ,Politics
 단독  김행  디시인사이드발 주가조작 당시  쩐주  회사 대주주였다,Politics
 영수회담 거부   옹졸  이상도 이하도 아냐    민주     에 거듭 촉구,Politics
김종인 명의 도용에  대통령 사진까지   선넘은 가짜광고,Politics
민주  이균용 대법원장 후보 임명안 당론 채택 불발  일 재시도,Politics
   사법리스크 로 날 저문 정기국회 전반기 앞으로도  탄핵정국  암운,Politics
민주  박광온  이재명에   선 후퇴  요청 사실 아냐  종합 ,Politics
홍익표  유인촌  김윤아 신중해야  발언 자체가 블랙리스트 ,Politics
 단독  김행 양평원장 때 창업회사와 계약  한 건 더 있었다    일감 몰아주기 의심 ,Politics
 더뉴스  영수회담 청문회 강서구청장 보선   이어지는 여야 격돌,Politics
 한국  미 중 사이  이슈 따른 동조와 반대  균형 외교 추구해야 ,Politics
김행 청문회 보이콧    임명 강행하려는 위법적 술수  철회 촉구,Politics
강서구에   만원 월세 든 김태우  분당 성수동엔 각각   억 아파트 보유,Politics
김행  부끄러움 없이 경영 청문회서 다 밝힐 것 ,Politics
오늘부터 맥주값 오른다  퇴근 후 치맥 부담되네 ,Economic
테마주 지고 대형주가 증시 이끈다,Economic
삼성전자    만전자  가나 증권가  실적 개선 시작 ,Economic
최희문 부회장의 메리츠증권 사모    의혹으로 최대 위기,Economic
 설마 우리 집도   새 아파트   곳서 폐암유발  라돈  권고치 이상 나와,Economic
   들 푹 빠지겠네  올 연말  스타필드 수원  베일 벗는다  송영찬의 신통유통 ,Economic
    에서 엑시노스까지 삼성의  신무기  줄줄이 대기,Economic
직무관련 정보로 전환사채 투자 수십억 챙긴 메리츠증권 직원들,Economic
 에코프로  넉 자만 붙으면 떴는데       앞둔 머티리얼즈  빨간불 ,Economic
작다고 외면 받던 전용    의 반란 소형 경쟁률  껑충 ,Economic
       보상 책임  힘겨루기에 입주민에 드리워진 그림자,Economic
호수 공원 품은  힐스테이트 수원파크포레    일  순위 청약,Economic
 이번 기회에 자동차 싹 고치세요 ,Economic
   년 동결 의대 정원  내년에 늘린다   의대 신설은  글쎄 ,Economic
     경기 부진 점차 완화      긴축 고유가는 악재,Economic
 일하는 사람이 실업자보다 적게 번다  취업 의욕 떨어뜨리는 구직급여,Economic
 그 좋다는  애플 구글 제쳤다  세계 최고의 직장 에 삼성전자,Economic
 싼 게 비지떡 이라던 중국     배터리는 어떻게 대세 됐나  아카이브 ,Economic
 삼성     내년    흑자전환 유력 관건은 이 팔 전쟁 시스템 육성 ,Economic
제프리스  테슬라의 업계 경쟁 우위 감소 목표가 하향 ,Economic
미래에셋증권  여의도 빌딩 매각설에  다양한 방법 검토중 ,Economic
올해     넘게 올랐는데  여전히 좋다  월가 추천 종목은 ,Economic
경총  최저임금보다 높은 실업급여  취업 의지 떨어뜨린다 ,Economic
   년 만기 특례보금자리론 받은   대 이상        대는  명 ,Economic
카드대출   조 저축은행보다 요주의비율 높아졌다,Economic
워트    년간 흑자 행진 세계적 공정환경 기업으로 도약 ,Economic
 단독  허술한 업체검증에 정보유출 의혹까지 구멍 뚫린 스마트스토어,Economic
삼성   전자  호 실적 등에 업고 주가 반등 기대감  업 ,Economic
북미 전기차 성장세 덕에   엔솔  분기 영업익 신기록 또 경신,Economic
앨리슨 전 미 차관보  한국은 미 중 러에 더 발언하라 ,Economic
     억도 싼데   에이티넘 마지못해 내놓은 클로버추얼패션 지분  신한벤처가    억어치 떠간다,Economic
한국 거지방 열풍 탓    명품주 루이비통  매출 증가세 반토막 난 이유는  ,Economic
    지분 조정 선 그은    의결권 확대 물건너가나,Economic
인사동 북촌 한옥 건물 신축하면 최대      만원  지원받는다,Economic
월    만원 연금처럼 준다더니 잠적 은퇴자금 노리는 불법 유사수신,Economic
 삼성전자    실적   갤럭시  가 살렸다      반도체 적자 속 호실적  견인 ,Economic
은행권   월 들어 가계대출 금리 줄인상  대출수요 억제 ,Economic
쿠팡  대만 로켓배송  년 만에   중기  만    곳 동반 진출 ,Economic
   마켓워치 시리즈         에만 돈이 몰린다,Economic
우유에 이어 설탕 소금 가격도 들썩 외식물가 상승 압박 커지나 ,Economic
오는   일부터   조원 규모    보증 실시된다,Economic
      공정환경 전문기업 워트      수혜 기대   글로벌 시장 공략 ,Economic
  절주절   악마의 장난 이 만든 축배,Economic
오비맥주  사실상 두 번째 가격 인상 눈치 보는 주류업계,Economic
나혼자 산다  그런데 없어서 못 산다 소형아파트 인기폭발,Economic
     만원으로 시작한 회사  유진테크놀로지  코스닥 도전,Economic
서울 지하철      호선 노후 전동차    칸 교체,Economic
 이슈   중동 지역 확전 우려 중동발  오일쇼크  전망은,Economic
 통화 완화  경기 부양 기대  아시아 증시 상승세,Economic
유진테크놀로지    월 코스닥 상장  글로벌 이차전지 부품 소재 기업으로 도약할 것 ,Economic
 최고의 호재는 주가 급락  리비안  매수 시점 왔다 영상 ,Economic
중동분쟁  미 이란 확산시 국제유가    달러 상회,Economic
 월 경상수지     억달러 흑자  수출   개월 연속 감소  불황형  여전,Economic
   오염수 방류서 환경부 직무유기  한화진  국내 영향적어 ,Economic
미래에셋 대신증권 빌딩 매각  동상이몽  현금 확보 종투사 진출 속도,Economic
경기 남부와 북부 아파트값  격차  벌어진다,Economic
  억원  국민 평수 도 없어서 못 들어가 알짜 교통중심지 어디길래,Economic
    콘서트 방영되자 뮤직카우서 대표곡 검색량  배 됐다,Economic
치솟는 기름값  경기 회복 걸림돌      대외 불확실성 여전히 커 ,Economic
서울대병원 노조 무기한 파업 시작  응급실 중환자실 인력은 제외,Economic
자동차 정비소 보험금 허위 과장청구 지속    금감원 소비자 경보 발령,Economic
광명 부동산 상승세  철산자이 브리에르  분위기 이어가나,Economic
      앞세운 테슬라 벤츠 제치고  수입 전기차  위,Economic
 상사 투자한 버핏  일본에 더   금융주 들어올 가능성 ,Economic
금융위원장  불법 공매도 방지 전산시스템 구축  기술적으로도 쉽지 않아 ,Economic
루닛 폴라리스오피스  성장세 이어진다  뜨거운   현장,Economic
내부정보 이용 수십억 챙기고 갑질까지 사모   위법행위  덜미 ,Economic
  엔솔  어닝서프  역대급 분기 영업익,Economic
 건설중장비의 제네시스 꿈꾼다  브랜드 독립시키고  홈쇼핑서 팔고,Economic
경매 낙찰률 떨어져도 인기 아파트엔 돈 몰린다,Economic
고조되는 이 팔 전쟁 우려  코인은 정말 위기에 강한가   엠블록레터 ,Economic
시중은행 대출금리 줄인상 가계대출에 제동 건다,Economic
 포스코 에코프로   차전지주 동반 급등 코스닥    ,Economic
  대 금리에 이자부담 막막  은행권 개인사업자 대출    조,Economic
   년된 우리 아파트도  등급인데    이미연의 발로 뛰는 부동산 ,Economic
조단위 영업익 회복한 삼성전자     반등 속도낸다,Economic
 어바웃   박현철 부국증권 대표  진격의  년     외길  강소 증권사 굳히기,Economic
금융위원장  은행   년만기 주담대  금융상품 상식에 맞지 않아  종합 ,Economic
현산  월계동신 공사비         만원 제시 조합  더 낮춰야 ,Economic
      국감  금융위  은행 중도상환수수료 체계  살펴보겠다 ,Economic
치솟는 금리에 예금도  짧고 굵게    개월 미만 단기 정기예금 선호,Economic
 세인트존스 양양 더 스위트  펜트하우스 별장형 호텔로 눈길,Economic
코스피  삼성전자  깜짝 실적   국채 진정에    급등 투자    ,Economic
 역시 드라마는 반전드라마  물린   엔솔 주주들  탈출 기회 잡을까  투자    ,Economic
  엔솔 배터리 판매량         위  기업 추격  속도 ,Economic
 이 팔 전쟁  암초 만난 경상수지  회복 흐름 이어갈까,Economic
급증하는 가계대출 제동 걸리나  시중은행  대출금리 인상 시작,Economic
 어르신 배당금 드려요  노후자금 노리는 유사수신 사기  주의 ,Economic
아직 한 달 남았는데  블프  경쟁 치열하네,Economic
정무위 국감장에 공매도 논란  김주현  기관 투자자 유리하지 않아 ,Economic
  월 코스닥 상장 유진테크놀로지  금형 기술로 전기차 시장 동반 성장할 것  투자    ,Economic
경총  월급 웃도는 실업급여 취업 의지 꺾는다 ,Economic
최태원  승계 계획 준비 화웨이폰에    칩 탑재  미스터리  ,Economic
 오염수 희석 방류  국제적인 방식   국감 달군  후쿠시마 논란 ,Economic
  현대   호위함 입찰 무효 가처분 기각에  방위산업에 부정적 영향 ,Economic
이오플로우   법원 판매금지 가처분   적극적 대응 전략 수립 중 ,Economic
두나무 자회사 잇단 수장 교체 람다    대표에 레벨스 전    ,Economic
강민국  소상공인 평균 대출금리 매년 증가 토스뱅크        금리 인하 필요 ,Economic
  국민 신한 우리 대출 금리 올린다 이자 인상 도미노,Economic
김장철 다가오는데 절임 배추 가격 한 박스  만 원대  물가 비상 ,Economic
김주현    년 주담대  상식 안 맞아 지적 부동산 정책 모순 아냐 ,Economic
수상한  정비업체들  허위견적서로 보험금    억원 챙겼다,Economic
 이스라엘 전쟁에   방산주 계속 상승할 것 ,Economic
    리서치 부국장  이 팔 전쟁으로 인플레 높아질 위험  주시,Economic
올해  월까지 누적 경상수지   최악 이던 작년 절반 수준,Economic
 메리츠증권 직원들  가족 동원해 수십억 사익 챙겨   권영훈의 증시뉴스      ,Economic
 가계부채  대책 지적 빗발에 김주현 위원장  정책 모순 아니다  종합 ,Economic
에디슨 품은     결국 초소형 전기차 외면했다,Economic
올해 삼성전자 시총   조원  에코프로는  배 뛰어 투자    ,Economic
김주현  공매도 전산시스템 도입  부정적  개인 보호 의문 ,Economic
유광점퍼 입고 등장할까    구광모 회장  한국시리즈 참석 전망  김익환의 컴퍼니워치 ,Economic
 년 만에   대  이    대   됐다 국민평형도 제낀 이 아파트,Economic
쿠팡  대만 진출  년 만에 수출     만    곳 돌파,Economic
 김대호의 경제읽기  삼성전자   분기 영업익    조 반도체  바닥 돌파  ,Economic
 연     치솟는 주담대 금리에  매물 쌓이는 서울,Economic
 단독 애플페이  일반카드보다 수수료 수입 적어,Economic
대우건설  이달 중  관저 푸르지오 센트럴파크  분양  집슐랭 ,Economic
 반도체 바닥 찍었다  삼성전자 질주에   만전자  기대 모락모락,Economic
메리츠    본부 임직원  조직적 부정거래로 수십억 사익,Economic
 역시 머슴도 대감집에서   삼성전자   세계 최고의 직장   위,Economic
     만원 넣으면 월    만원 드려요  노년층 타깃 유사수신업체 기승,Economic
 반토막  난 한국 경상수지 희미한 호재 속 고유가 복병,Economic
대규모 반도체 적자에도   삼성전자  희망의 신호탄  쐈다,Economic
  인  역  최태원 회장의 광폭 행보 재계 넘어  사회적 리더 로 우뚝,Economic
 어르신  매월 배당금 챙겨 드려요  노후자금 노리는 불법사금융 주의보,Economic
 분기  어닝 서프라이즈  삼성전자   전자 실적 개선   경기 반등  청신호 ,Economic
물속     냄새까지 맡고  왈왈   실종자  명 찾아낸 수난탐지견,Economic
밀리의서재 직원  인당     억 대박  스톡옵션으로       수익,Economic
가격 반토막으로  뚝    킹크랩 먹기  지금이 기회   지금이뉴스 ,Economic
 단독  먹태깡 이어  품귀 원조  허니버터칩 콰트로치즈맛 나온다,Economic
     국감  김주현     년 주담대  문제 있었다   특례보금자리론은 다른 성격 ,Economic
코인으로 전비 조달하던 하마스  이스라엘 경찰에  덜미 ,Economic
금융위원장  은행권    년 만기 주담대  비상식적 정책 모순 아냐 ,Economic
 고유가에   조 챙긴 정유사  전기요금도     억 감면받아 ,Economic
삼성전자   분기 영업이익  조 천억  깜짝 실적 ,Economic
 대리점 계약 끝나면 보증금 즉시 반환   계약서에 못박는다,Economic
     년 국정감사  김주현  부동산 정책 모순 아냐   년 주담대  은행에 문제 제기한 것 ,Economic
환경부 국감서  오염수  공방 장관  적극해명 에 야당  고성       국정감사 ,Economic
 단독  생맥주 납품가     올랐다 소비자에 전가되나,Economic
  곳 부도에 이스라엘 하마스 전쟁까지 건설업에 혹독한  겨울한파  온다,Economic
사리사욕 채운 증권사 직원들 가족 명의로    투자하다 적발,Economic
 수원 전세 사기 의혹  피해 신고    건 하루 만에   건 늘어,Economic
 어르신들 불법 유사수신업체 조심하세요 ,Economic
김주현  공매도 실시간 전산시스템  개인 위하는 길 아냐 ,Economic
금융위원장    년 만기 주담대  금융상품 상식에 맞지 않아 ,Economic
코스닥    대 급등해    선 회복 에코프로비엠   대 ,Economic
 주가동향  키움증권  주주환원 정책 강화 발표에 주가     이상 급등,Economic
버크셔 부회장 찰리 멍거   가상자산 가치     될 것 ,Economic
증권사     충성도  위    투자증권     위는 키움증권,Economic
 점심브리핑 주요 가상 자산 약세 리플 최고재무책임자 사임,Economic
삼성전자 영업이익 올해 첫 조 단위    반도체 회복세 ,Economic
올해 국내 증시 시총    조 늘었다  삼성전자    조  껑충 ,Economic
     반도체 생산 호조에 제조업 부진 완화 ,Economic
이 팔 전쟁에 급등했던 국제유가  하루 만에  안정세  되찾아,Economic
하이패스 오류로 이중부과된 요금     만원    는 환불 안 돼,Economic
