titles,category
충남 서산 상가서 폭발 사고   대 여성 등  명 다쳐,Social
김태우  보복판결 심판론 에  판결은 투표 심판 대상 아냐 ,Social
부산지하철노사 오늘 최종교섭 돌입 결렬시 내일 첫 차부터 파업,Social
 일본군 몰살 계획  세웠던 권중혁 애국지사 별세 향년    세,Social
 도마 파서 필로폰 숨겼다       억원어치 마약  국내 반입한 다국적 범죄 조직 검거,Social
 고액 의견서 논란  권영준 대법관  재판   건 회피    민폐 ,Social
 교권  교육권 교사인권으로 바꾸고 명시적으로 정의해야 ,Social
거제시민 거가대교 통행료 평일에도     할인 될까 ,Social
   가 비보호 좌회전 하던 승용차 들이받아  명 부상,Social
이상민 장관도  깜짝 놀랐다  선관위 해킹 시도  만건 육박,Social
 고생만 한 며늘아 잘 살거라  베트남 부모님 마중가다 아들과 참변,Social
 휴게소 주차장에 상 펴놓고 술판 벌여    단체 등산객들 민폐  눈살 ,Social
 화순 고인돌 가을꽃 축제로 초대합니다 ,Social
이주호      대입개편 따른 수능 내신 변별력 변화 없을 것 ,Social
한 달 내내 콜록콜록  감기가 왜 이리 오래 가지  이유 밝혀졌다,Social
김행 후보자  민주당 묻지마 고발 환영 당당히 수사 응할 것 ,Social
이균용 낙마  국감서도 공방  지명부터 잘못   정쟁 대상 돼 ,Social
 연예인 마약투약 모습 봤다 신고  경찰 출동하자 도주,Social
소갈비  인분 시켰는데  인분만 준 식당 이유 들어보니  황당 ,Social
주민등록 말소된지   년 영양결핍 상태로 발견된   대,Social
최근  년간 동물원서 멸종위기동물     마리 폐사    분의   질병 사고사 국감     ,Social
 투자 수익 보장   억 갈취해   년 간 필리핀 도주 징역형,Social
 피해자    명 영상    만개  관악구 모텔서 불법 촬영한  불체 중국인 ,Social
주유소 실수로 혼유 사고 수리비     만 원 운전자도 책임 있어,Social
포스코    일 첫 중노위 조정신청 창사   년만에 첫 파업 기로,Social
   경찰 불송치 사건 보수사 가능 경찰   차 수사종결권 축소,Social
석달간 반성문   차례 낸 정유정 재판부  반성인지 아닌지 헷갈려 ,Social
 연예인 마약하는 거 봤다니까   의문의 신고에 트럭 쫓아갔더니 ,Social
경북대병원 노조   년 만에 총파업      일부터 돌입,Social
 법정 구속  박광순 성남시의원  의장직만 사임    난항 예상,Social
사라지는  응애  소리   제주 산부인과     신생아 출산 없었다,Social
배달음식에 젓가락 없다며 환불 요청  음식은 내가 폐기할테니 오지 말라 는 손님,Social
  억원대 가상화폐 사기 수사무마 청탁   대  구속 기로,Social
모텔에 카메라 설치해 투숙객    명 불법촬영한 남성 구속,Social
관악구 모텔에 몰래카메라 설치한   대 중국인 피해자만    명,Social
이충원 경북도의원  대구경북통합신공항 화물터미널 의성 배치 강력 촉구 ,Social
서울 모텔에 몰카 설치한   대 중국인 불법촬영물     만 개  쏟아졌다,Social
모텔서    여 명 투숙객 불법 촬영한 중국인 남성 구속,Social
드라마  힘쎈여자 강남순  엄마 황금주 스핀오프 웹툰 공개,Social
순진한 청소년 이용한 나쁜 어른들 내버려두나 노동법 위반      ,Social
 고용부 기금 중 유일하게 적자   임금채권 보장기금  어쩌나,Social
  일 구속 만료되는 이화영  변호인  석방 상태로 재판받게 해달라 ,Social
광주시  업무상 배임 혐의로  대회 청산법인 고발,Social
 백현동 로비스트  김인섭 보석석방  관련자 접촉 금지  조건,Social
의암호 마리나사업  부실검증  논란 춘천시  경찰 수사 보고 판단  종합 ,Social
     대입  교원단체  특목고에 유리 고교학점제 무력화  우려,Social
 어디 젊은 사람이  비켜  출산 앞두고도 앉을 수 없는 임산부 배려석  르포 ,Social
 허위 인터뷰  의혹 김만배 검찰 출석 석방 후 첫 조사,Social
외제차 범퍼 너덜거릴 때까지 박았다  차량  대 파손한 음주 운전자,Social
여성 유리천장 연구 노벨상수상 여교수   남편은 하버드대   세 연하 교수,Social
 어렵게 합격했는데  년간 백수  지방공무원     명  임용 대기 ,Social
 단독    일가 상속 소송 시작하자마자 변호인 또 이례적 사임,Social
검찰   신학림과 허위 인터뷰 의혹  김만배 소환 조사,Social
 무염지욕      반헌법적 처사   대구시 구미시  구미산단 환경문제  갈등,Social
 인터넷언론사 심의한다는데 조선일보 기사는 어떻게  질문에 돌아온 황당한 답변,Social
관악구 모텔서    여명 불법촬영     대 중국인  쇠고랑 ,Social
마라톤대회에 이단 신천지 신도 대거 참가 기독교계 반발,Social
 다치게 할까요  건보공단 조사원 태도 논란 건보공단 측  조사 지연 행위에 법적책임 고지한 것 ,Social
 플라스틱이 어떻게 목에 넘어가나   유산한 임신부 몰아세운 카페 사장,Social
북한이   억 받고  천억 포기했다     이화영    ,Social
종점 바뀌면 교통량  천대 증가  양평고속  조사  왜곡  의혹,Social
 단독  구내식당 급식 때문 아니다  대구 한 대학교 집단 식중독  미스터리 ,Social
민주노총 공공운수노조    일부터 파업 돌입 전국 단위 의료공백 재연되나,Social
 뉴블더  마음껏 쉬어도 월  백  직장인 절반  절레절레   왜,Social
      대입 개편안     정시 비율 그대로 수능 자격고사화는 신중 검토,Social
 뉴블더  보이스피싱범 목소리 변조 없이 공개 의외의 수법은 ,Social
 일 못하게 협박하고 괴롭힘 당해   장애인지원기관 팀장 유족  노동청 진정,Social
모텔서 낳은 딸  층 창밖으로 던져 살해 엄마 구속영장 종합 ,Social
부산지하철 노사 최종 교섭 돌입 오후  시께 결과 나올듯,Social
 감시하세요   자리 옆 지나갔다고 신고 당했다  을의 갑질 ,Social
홍준표  상여 메고 시위  판 깨자는 것 ,Social
법원  불법취득 국유지 환수보상금  정부에 반환하라 ,Social
산업부 공무원의 상상초월 갑질 법카    번 긁고 가족들 먹을 빵 심부름도,Social
독립투쟁 위해 일본군 탈출한 권중혁 애국지사 별세,Social
   명 당했다 모텔서 성행위 나체 불법 촬영해 시청한 중국인,Social
부친 친일 논란에     김대규문학관 이  안양문학관 으로,Social
검찰  허위 인터뷰 의혹  김만배 소환 석방 후 첫 조사,Social
    학년도 수능 국어 수학 공통과목 체제로  통합사회 통합과학  함께 응시,Social
검찰  생후  개월   방치해 사망케 한 친모에   년 구형,Social
 한국 와 고생만 했는데  베트남서 온 친정부모 만나러 가던 길에 아들과  참변 ,Social
 단독  우울증 치료제 수면제  약물중독  사망  이틀에 한 명꼴     년간     명 육박,Social
   아이 출산 직후 방치 살해한   대  지탄  제대로 된 반성 아냐 ,Social
     명 살해 협박글    대  부모에 효도하겠다  선처 호소,Social
서이초 사건  범죄 혐의점 발견 못했다는 경찰   심리부검 하겠다는데,Social
 이승만 정권이 집단학살  민주인권기념관 사실 왜곡 논란,Social
주차장 붕괴 검단아파트  철근 누락에 미인증 순환골재까지 썼다,Social
관악구 모텔서    명 촬영   불법체류 중국인 소행,Social
  중 부터 수능 선택과목 사라진  내신     등급제 변경,Social
경기지역 버스노조   일 총파업 예고 노동쟁의 조정신청,Social
이상민  책임자 사퇴로 재난 예방 못해  여야 이태원 오송 참사 공방,Social
오징어 한 마리 위판가  만   원 회 한 접시는  만원 ,Social
가짜뉴스 근절 내세웠지만      민원 창구  된 방심위 전담센터,Social
 국감      단독 국내 가전업체 가습기 살균필터서도 유해 우려  은  검출   환경부는 확인하고도 비공개,Social
 빨라지는 총선시계  원주 갑을 자천타천 물망 여야 후보군   여 명,Social
 돈봉투  의혹 윤관석  사실상 무죄 주장 보석도 요구,Social
인천 앵커리지 직항 노선 재개   힘 모은다,Social
내일부터 어르신 독감 백신 무료 예방접종 시작  코로나   접종도 같이 하세요 ,Social
인천 검단신도시 광역교통 개선책 이행률     기 신도시 중 최저,Social
 말하는데 문 닫냐  이웃에 흉기 휘두른   대 구속영장,Social
출생률 상승 원한다면    필요한 정책은 따로 있다,Social
 광주형 일자리       캐스퍼 누적 생산   만대 돌파,Social
이화영    일 구속 만료  석방 상태서 재판받게 해달라 ,Social
흉기난동 심야 집회 금지 등 경찰청 국감  여야 극한 공방 예고,Social
청주시의회 한재학 의원 돌연 사직  개인 사정 ,Social
 내신 수능 변별력 약화 걱정 대학별 논술 시험 강화될 수도       대입개편 ,Social
 새울 원전    호기 서생에  유치전 본격화   반대 여론도,Social
급발진 의심 사고 늘어나는데  국토부 조치는 제자리걸음 ,Social
오송 참사 유가족 생존자  관계기관 부실 대응 낱낱이 살펴봐야 ,Social
 연예인 마약 투약 현장 목격했다  경찰차  대 들이 받고 달아난   대,Social
    억원 상당    만명 투약분 필로폰 유통  국 마약조직 검거,Social
 플라스틱 스무디  업주  혀 예민한데 목에 넘어가    법적조치 예고에 태세 전환,Social
그냥 쳐다봤다고 스토킹 고소    회 허위민원에 골치 아픈 경찰,Social
 사랑의 시인  김남조 시인 별세 향년   세,Social
     대입제도 바뀐다 통합 수능 내신  등급 개편,Social
  인기 아랑곳  도적  선택한 김남길  자랑스럽다  서경덕 극찬,Social
     대입  각 대학  전형요소 추가 검토 서울대  큰 변화는 없어  종합 ,Social
화천에 마지막 남은 웅담 채취용  사육곰  동물보호단체에서 구조,Social
민주당 한재학 청주시의원 돌연 사직,Social
박주선 전 국회부의장  윤 대통령  이재명 만나 국정참여 권유해야 ,Social
동해안경제자유구역 망상 지구 대체사업자 공고   지구 실시계획 승인 임박,Social
이주호  선택 과목 아닌 실력 노력만으로 수능 점수 결정될 것 ,Social
     대입  입시업계  수학 국어 쏠림 우려  학부모  혼란스럽다 ,Social
정유정    주간   차례 반성문   재판부  원하는 대로 해달라는 소리 ,Social
저출산인데  너무 비싼 산후조리원     우울한 임산부의 날,Social
관악구 모텔에 설치된 불법카메라   카드엔  초 영상    만개,Social
 초코파이 준다 길래 시작했는데  헌혈왕 된   대 직장인,Social
국토부  대안노선  천대         양평 신도시 생기냐 ,Social
경북 유아대상 영어학원  내 외국인 강사 중 자격증 소지자는  명,Social
 지하주차장 붕괴  인천 검단 아파트  미인증 골재 사용 논란,Social
대치도서관   월   일 운영 종료    항의글만    건 넘게 올라와,Social
 살아있는지 몰랐다  출산 다음날 영아 유기한   대,Social
 방 안에  개 오줌   사장은  만취   연휴 때 가족과 펜션 찾았다  봉변 ,Social
내년 초 대법관 제청 차질 예상  대법원장 공백 당연히 해결돼야 ,Social
서울대        대입안  큰 영향 없어 본고사 부활 없을 것 ,Social
 아이 항문에 대변 묻어 속상  학부모의 황당 민원,Social
  개월 아들 굶겨 심정지    대 친모  심도 징역   년 구형,Social
 여성   명 살해  협박글 올린   대   효도할 수 있게 선처를 ,Social
생후  개월 아들 방치해 심정지 친모에  심도 징역   년 구형,Social
모텔방에 놓인  수상한 공유기  남녀    명 찍혔다,Social
정우택  오송참사 근본원인은 제방붕괴 현장 공무원에 책임전가 안돼 ,Social
학생수    명인 고교   내신  등급   명서   명으로 늘어난다,Social
  대통령 책임      견강부회  대법원 국감   이균용 부결  공방,Social
고령층 독감 무료 백신  내일부터 접종 시작,Social
 연말 내년 초 피해 본격화할 것  커지는  수원 전세사기  우려,Social
 서이초 학부모  혐의  못 찾았다   개월 수사에도 이대로 끝나나,Social
 위니아 법정관리  광주상의  협력사 긴급자금지원 요청 ,Social
 야간집회 금지    경찰청 국감서 치열한 공방 예상,Social
초코파이 준다는 말에 시작한 헌혈     번한 직장인,Social
양평고속  국지도  기능 중복  김건희 일가 땅  특혜의혹 ,Social
      대입 개편안  내신등급 유리한 과목 쏠려 고교학점제 퇴색 우려,Social
서울대병원  내일부터 파업 돌입 일부 진료 지연 우려,Social
김영걸 목사     회 부총회장 취임 감사예배 드려,Social
 단독  배재정  의원 관련 사무실에서 발견된  입당원서    결정적 물증되나,Social
 영상  범퍼가 너덜너덜  저 차 뭐지  경찰 눈썰미에 딱 걸렸다,Social
 아직도   대 금리 쓰세요   김동연 시석중 콜라보  경기 기회   특례보증 시행,Social
 년간    차례  가상환자      억 천 가로챈 원무팀 직원,Social
 이 팔 전쟁  한국서도 고국 걱정에 전전긍긍 의견 달라도  평화  한목소리,Social
 개월 아들 학대 방임한 친모에 항소심서도 징역   년 구형,Social
 역대 최대 규모      회 전국체육대회   일 개막,Social
정유정 반성문   번 제출했다 재판부  반성인지 아닌지 헷갈릴 정도 ,Social
서울대병원 노조  내일 파업   건보 노조도   일까지 순환 파업,Social
서현역 흉기난동범 최원종 정신감정 의뢰   테러범이나 마찬가지  유족 반발,Social
지금 중 부터 수능 선택과목 폐지     년도엔 내신  등급도 없다,Social
 이스라엘 맞선 저항 정당  한국서 팔레스타인 이슬람단체 지지 집회 열린다,Social
주차장 붕괴 인천 검단아파트   미인증 순환골재  사용  개동     등급,Social
 중학교  학년 주목  수능 선택과목 폐지와 내신  등급제,Social
이주호  수능 공정성 높이겠다   수능 선택과목에서 공통과목으로 종합 ,Social
 대입 개편 선택  심화수학  도입되면 업계  주요대 의대엔 필수될 것 ,Social
전기 가스 끊긴 원룸서 주민등록 말소   대 구조,Social
 사랑의 말은 사라지지 않는다  한국 여성 시단 대표 원로 김남조 시인 별세,Social
 단독  이민청  강조하던 법무부  이민정책  회의는    일간  전무 ,Social
 사랑의 시인  김남조 별세   향년   세,Social
캐스퍼   만대 돌파 상생 최고 품질 원동력,Social
 영상   연예인 마약 목격  허위 신고하더니 갑자기 도주 차량  대 들이받고 검거,Social
 밤에 빛 많이 보면 정신건강에 해로워  호주 대학 연구결과 발표,Social
 백현동 로비스트  김인섭 보석 석방 전자장치 부착 등 조건,Social
서울대  학종 등 입시안 큰 변화 없어 변별력은 고심중        대입개편 ,Social
   분 일찍 출근 강요      조금 서둘러달라  홍천 모 조합 근로자 사직 원인 공방,Social
 유럽연수  오산시의회  술집 사진 유출  논란  문제 없어      내로남불 ,Social
            전설이 된  청담동 호러    주년 맞은  장화  홍련 ,Social
 뉴스외전 이슈    돈 봉투 수사  반년 의혹 규명 어디까지 ,Social
이상민  탄핵시 무조건 권한정지  다시 검토해야 ,Social
새 대법원장 후보는 누구  하마평 오르는 오석준 홍승면 조희대,Social
 오늘의 앵커픽  이스라엘  이제 시작  하마스  인질 처형   ,Social
헌혈    회 달성한 직장인  타인 쉽게 도울 수 있어 ,Social
 이 팔 전쟁  하마스  근접사격 약탈 대피소에 수류탄까지,Social
인천시내 종합병원 병 의원들   약 처방  늘렸나,Social
한겨레 노조위원장  개월째 공석,Social
현 중  수능부터 선택과목 폐지 내신은   등급 평가제 로 전환,Social
 부실 제주 제 공항 고시 중단하고 주민투표를 ,Social
 시사이슈 찬반토론  특정대학 쏠림  공기업 지역인재 의무채용   문제 없나,Social
    년 대입부터 고  내신  등급제로  숏잇슈 ,Social
이화영    일 구속 만료 변호인  석방 상태서 재판받게 해달라 ,Social
서울교통공사 노조 간부들  출근도 안하고 월급은 받았다,Social
 선택  뺀  공통  과목 위주     년 수능에  의대쏠림 심화  우려,Social
 국뽕 차오른다   아시안게임 선수들 탄 비행기 안내방송에  울컥 ,Social
    년 수능부터 선택과목 없어진다 내신은  등급   등급  상대평가,Social
중 부터 수능 선택과목 없이 공통과목 내신은   등급  상대평가로 변경,Social
행안위 국감   이태원 참사  이상민 장관 책임 두고 여야 공방,Social
관악구 모텔 불법촬영   대 중국인 구속 송치 영상    만개,Social
오송 지하차도 참사  행복청  역할 책임 다했으면 막을 수 있던 사고 ,Social
 서부발전  새만금 태양광 수익 스스로 포기    박수영 의원  군산판 대장동 ,Social
      대입안 에 서울대  입시 방식 변화 없다 본고사 부활도 안해 ,Social
교사 간곡한 요청 끝에 화천 마지막 사육곰 농장서 구조,Social
김진태  강원도청 소속 아시안게임 메달리스트에  억원 포상금 ,Social
피해 영상만    만 개  서울 관악구 일대 모텔에 불법 카메라 설치한 중국인 구속,Social
 재난은 반복되기 마련  이상민  이태원 참사  주기 앞두고 또 도마에,Social
 단독  산재 판정 기다리다 사망한 노동자  년간    명,Social
천안의료원 의료직 직무만족도 충남 공공병원 중 최하,Social
관악구 모텔서    여명 불법 촬영한 중국 국적   대 남성 검거,Social
골프장 우후죽순 천안시 북면  몸살 ,Social
일면식 없는   대 여성  명 폭행한 고등학생 구속 성범죄 전력도 있어,Social
 세종의사당 축하합니다  민주당 시의원들 연일 거리 인사,Social
직원 실수     만원 혼유 사고  운전자도 잘못있어 ,Social
대법원 국감장 덮친 김태우  보복판결  현수막     우려스럽다 ,Social
    조 부채 한전  최근  년간 수당 외 자체 성과포상금  억원 지급 ,Social
 사랑의 시인  김남조 시인 노환으로 별세 향년   세,Social
 너네 아빠 빡빡이 문신충  놀림당한 자녀 오열에  조폭 문신  남성 후회,Social
박상돈 천안시장  흥타령춤축제 삼거리공원 대신 불당동 지속 개최 검토,Social
제주 드림타워 시공사  공기업 하도급업체 갑질로 과징금,Social
올해 중  치를 수능부터 선택과목 폐지 내신은  등급 상대평가,Social
 아내가 유부남과 단 둘이 해외여행 못믿냐고 되레 화내는데 ,Social
 대입 개편 서울대  정시 교과반영 파격적 확대는 없다 ,Social
 주유소 직원  혼유  실수  운전자 잘못도 있다네요 ,Social
하마스 고위급 간부  이스라엘군 종이호랑이  조롱 이 팔 전쟁 ,Social
 유신 시절 유언비어유포죄 떠올라  가짜뉴스 규제 논의에 쏟아진 비판,Social
제주 공항저지도민회의 국토부 기본계획 고시 중단 촉구,Social
사랑을 노래한 시인 김남조 별세 향년   세,Social
관악구 모텔  곳에 몰카    명 불법촬영 중국인 불체자,Social
경기도  광주 도시기본계획 승인     년 인구   만    명 목표,Social
 교권침해 당하면     로 신고하세요  직통전화 내년  월 개통,Social
서울대  학종 등 입시안에 큰 변화 없어 본고사 부활 안 해 ,Social
부산지하철 노사 최종 교섭 시작 오후  시 결과 윤곽,Social
      울산과학기술원  과학영재학교 설립 추진,Social
서울대       수능안에  학생부로 변별 가능  본고사 부활 없다 ,Social
주차장 무너진 인천 검단아파트  미인증 순환골재  사용한 듯,Social
산후조리하러 경기도서 강원도까지   저출산에 줄어드는 산부인과 산후조리원,Social
반성문 석달간   번 제출한 정유정 재판부  반성하는지 헷갈려 ,Social
용인 이동읍 덕성 천리      상습정체 해소 편도  차로  차로 확장,Social
 서현역 흉기 난동  최원종 정신감정 요구  유족 측은 엄벌 호소,Social
 수능 국수탐 선택과목은 없애고 고교 내신은  등급제로   오늘의 정책 이슈 ,Social
아내 몰래 코인 샀다  억 빚진 남편 이혼 요구에  반은 네가 갚아 ,Social
서울대병원 노조   일부터 파업 나서  정상 운행 차질 예상 ,Social
  중  대학 갈 때 수능 사회 과학 다본다 내신   등급  상대평가,Social
한국을 대표하는  사랑의 시인  김남조 시인 별세   향년   세,Social
 제주도민 선호  개 행정구역안  개편 방향에서 배제 ,Social
북한강 상류 하천변 점령한  가시박    자치단체 대책 마련에 전전긍긍 현장에서 ,Social
국정원  투 개표 시스템 해킹 취약     선관위  불가능한 시나리오 ,Social
 전세금 못 받을 거 같다  수원 전세사기  눈덩이  피해신고    건,Social
김포 오피스텔 전세사기 또 터지나 임차인  명  집주인 고소,Social
한 교사의 후원 덕에 화천 마지막  웅담채취용  반달가슴곰 구조,Social
국민의힘 양홍규 대전서구을 위원장  박범계 의원 사퇴 촉구,Social
올해 중 부터 고교 내신   등급  수능 선택과목 폐지,Social
 자막뉴스  늘어나는  수원 전세사기  피해자   임대인 입장문에는,Social
소리 없는 아우성 용산에 닿을까 전북도의회   일째 릴레이 단식,Social
  신공항 화물터미널 갈등  대구시 불통  경북도 무능 ,Social
 도마에 백색 가루가   다국적 마약조직   명 구속,Social
      국정감사  법사위 국감 첫날  대법원장 공백 두고 책임 공방,Social
아시안게임 열기 이을 전국체전   일 개막 역대 최대 규모,Social
이상민  책임자 사퇴로는 참사 재발 못 막아 ,Social
위니아 법정관리로 광주 협력업체들 줄도산  위기  긴급 금융지원  호소 ,Social
     억 가치  삼성 핵심기술   유출시도 전 연구원 재판행,Social
 연예인 협박해 수억 갈취 혐의  김용호 내일 구속 심사,Social
이상민  탄핵 권한 정지  추후 검토해볼 필요 있어 ,Social
 대입 개편   년만에 바뀌는 내신 등급  정부 방식  달만에 유지 폐기,Social
 자막뉴스  이스라엘 하마스 무력충돌   다시 떠오르는 오일쇼크 공포,Social
광명시  군대 가는 청년에게 입영지원금   만 원 지급,Social
      대입 중  대학 갈 때  이과의 문과 침공  어려워진다 선택과목 폐지  사 과탐 모두 응시,Social
 강북 상가 수십 곳 빈집털이    대  구속 송치,Social
캐스퍼 생산   만대 돌파    의 위용  미래  중심도시 광주 ,Social
류희림 방통심의위원장  인터넷언론사 심의 번복 논란에  법원    심도 달라  강변,Social
 부산 돌려차기   주거침입 항소하더니 재판 모두 불출석,Social
현재 중학교  학년부터 수능 선택과목 폐지  내신은  등급으로,Social
   일 구속만료  이화영  번째 구속영장 발부될까 변호인은 석방요청,Social
    억 상당 필로폰 국내 유통  개국 조직 검거,Social
선관위  국정원  투 개표 해킹 가능  발표에  내부 조력 없이 불가능 ,Social
모텔서 갓 낳은 아기 창밖으로 던져 살해한   대 체포,Social
딸 태우고 음주운전하려던    가족에겐 내가 필요  선처 호소,Social
 성폭행 의혹  미군 장병 국참 신청 피해자 측  비공개 재판 원해 ,Social
위니아 잇단 법정관리에 광주상의  협력사 긴급자금지원 건의,Social
휴게소 주차장에 테이블 펴고 술판  민폐  등산동호회,Social
 현장연결  교육부       대학입시제도 개편안 시안 발표,Social
 속보  현 중 부터 수능 선택과목 폐지 내신     년부터  등급제,Social
 사랑의 시인  김남조 별세 향년   세,Social
강진에  악몽  반복되는 아프간 지각판 충돌에  흙벽돌집  허약,Social
이화영 변호인  피고인과 소통 버겁다 추가 영장 기각 해달라 ,Social
세종 스마트시티 드디어  첫 발   어떻게 개발되나,Social
내신  등급제   수능  공통과목 화      대입 개편 시안 발표,Social
첫 민간 주도  세종 스마트시티  개발 본궤도 오르나,Social
포털 중국 응원 사태  해외세력 탓하다 말 바꾼 이동관,Social
기장군   억 들인 장미정원  억 들여 철거한다 전임군수 치적 논란,Social
박정훈 대령 변호인단  유출  괴문서 는 허위 부정한 목적 기소 ,Social
