titles,category
이준석     하고 자빠져  안철수 논란에  강서 지면  책임 ,Politics
김병민   강서    차  이준석 사이비 평론가 맞다    압승 점쳤다 사색 ,Politics
하태경  험지행  비판했다 역풍맞은 홍준표 ,Politics
출근길 점심시간 투표  강서 보선 오후 시 투표율      ,Politics
 국민 표 대신 뭘 지켰나  선관위  해킹 노출  논란 일파만파,Politics
홍준표 저격에 하태경  당 죽고 나만 살자 길  누가 선택했나 ,Politics
법사위 여야  전 현 정권 사안 놓고  팽팽  통계조작    인사정보단,Politics
비명계 찍어내기로 악용   중진  험지 출마론  불붙이는 친명계,Politics
 대통령  김행 임명  고심  신원식 유인촌엔 임명장  용산실록 ,Politics
 이재명 분당갑행 에  비명계  송갑석도 은근 힘 싣나  그게 맞다면 그렇게라도 해야 ,Politics
강서구청장 보선 투표율          작년 지방선거 대비       ,Politics
복지위 첫날   오염수  공방    질병청이 보고서 숨겨 ,Politics
 나라 안팎으로 무서워  투표소 찾은 강서구민들 바람은 르포 ,Politics
  대통령  신원식 유인촌 장관 임명장 수여 김행  임명  장고,Politics
 자막뉴스   기괴한 개조    전문가들도 놀란   핵잠수함 보니,Politics
정청래     정상외교에    억 본인 돈이면 이렇게 쓰겠나 ,Politics
천하람  윤핵관 서울 올라와야 제일 좋은 분은 장제원 ,Politics
    일 밤 탈북민    여명 강제북송   군사작전 하듯  곳서 동시에,Politics
천하람  홍준표  마음에 안 들면 다 배신자  박근혜를 향단이라 해놓고 ,Politics
장경태  소셜뉴스 최대 주주는 김행 후보자 딸 ,Politics
장경태  소셜뉴스 최대 주주는 김행 후보자 딸 ,Politics
환경부 장관    오염수 우리 영향 미미  자신 있냐  질문에  네 ,Politics
양평고속도로 노선 변경시  환경성 정책성  하락  원희룡 장관 답변은,Politics
한동훈  인사검증 문제에  성공한 사람들 대개 비슷한 문제 나오게 돼 있다 ,Politics
홍준표 저격한 하태경   당사아생  길 선택한 사람 누구였나 ,Politics
      억 원  합참 이전   감감무소식 인 이유는,Politics
 자막뉴스  한국    억 날릴 판   러시아 전쟁  불똥 ,Politics
 논란 키워 말아   선관위 해킹 가능  발표에  주판알  튕기는  ,Politics
 질병청  원전수 보고서 숨기곤 말도 안 되는 소리만 늘어놔  질타,Politics
 뉴스초점  강서구청장 보궐선거 국회선 이틀째 국정감사,Politics
김영호       군사합의  정찰자산 운용 과도하게 막아 ,Politics
여  박범계 출장비 축소 의혹  제기 박  축소 이유 없어  국감초점 ,Politics
 민병덕  대출 부당 가산금리  왜 기존 대출에선 안 빼나 ,Politics
 뉴스앤이슈  강서구청장 재보궐 선거         국민의힘 민주당 누가 웃을까 ,Politics
 년형 선고  서대문형무소에 수감,Politics
민주  모순된 정책 때문 가계부채 실패  사과해야  김주현  모순 아냐 ,Politics
송영길     번 넘는 압수수색 더는 당하지 않겠다  규탄 농성 선전포고,Politics
복지위 국감 여  문케어로 건보재정 악화     야  의대 정원 늘려야 ,Politics
교육위 국정감사에서  김건희 논문  증인 불참 논란 야  동행 명령장 발부해야 ,Politics
신원식  대화력전 전면 재검토  단시간 내 적 장사정포 궤멸시켜야 ,Politics
경기 남부와 북부 아파트값  격차  벌어진다,Economic
  억원대 고분양가에도 완판  광명시가 뜨겁다,Economic
광명 부동산 상승세  철산자이 브리에르  분위기 이어가나,Economic
내부정보 이용 수십억 챙기고 갑질까지 사모   위법행위  덜미 ,Economic
경매 낙찰률 떨어져도 인기 아파트엔 돈 몰린다,Economic
고조되는 이 팔 전쟁 우려  코인은 정말 위기에 강한가   엠블록레터 ,Economic
시중은행 대출금리 줄인상 가계대출에 제동 건다,Economic
 포스코 에코프로   차전지주 동반 급등 코스닥    ,Economic
  대 금리에 이자부담 막막  은행권 개인사업자 대출    조,Economic
   년된 우리 아파트도  등급인데    이미연의 발로 뛰는 부동산 ,Economic
조단위 영업익 회복한 삼성전자     반등 속도낸다,Economic
금융위원장  은행   년만기 주담대  금융상품 상식에 맞지 않아  종합 ,Economic
현산  월계동신 공사비         만원 제시 조합  더 낮춰야 ,Economic
      국감  금융위  은행 중도상환수수료 체계  살펴보겠다 ,Economic
치솟는 금리에 예금도  짧고 굵게    개월 미만 단기 정기예금 선호,Economic
 세인트존스 양양 더 스위트  펜트하우스 별장형 호텔로 눈길,Economic
코스피  삼성전자  깜짝 실적   국채 진정에    급등 투자    ,Economic
 역시 드라마는 반전드라마  물린   엔솔 주주들  탈출 기회 잡을까  투자    ,Economic
  엔솔 배터리 판매량         위  기업 추격  속도 ,Economic
 이 팔 전쟁  암초 만난 경상수지  회복 흐름 이어갈까,Economic
급증하는 가계대출 제동 걸리나  시중은행  대출금리 인상 시작,Economic
정무위 국감장에 공매도 논란  김주현  기관 투자자 유리하지 않아 ,Economic
  월 코스닥 상장 유진테크놀로지  금형 기술로 전기차 시장 동반 성장할 것  투자    ,Economic
경총  월급 웃도는 실업급여 취업 의지 꺾는다 ,Economic
최태원  승계 계획 준비 화웨이폰에    칩 탑재  미스터리  ,Economic
  현대   호위함 입찰 무효 가처분 기각에  방위산업에 부정적 영향 ,Economic
이오플로우   법원 판매금지 가처분   적극적 대응 전략 수립 중 ,Economic
두나무 자회사 잇단 수장 교체 람다    대표에 레벨스 전    ,Economic
  국민 신한 우리 대출 금리 올린다 이자 인상 도미노,Economic
김장철 다가오는데 절임 배추 가격 한 박스  만 원대  물가 비상 ,Economic
김주현    년 주담대  상식 안 맞아 지적 부동산 정책 모순 아냐 ,Economic
수상한  정비업체들  허위견적서로 보험금    억원 챙겼다,Economic
 이스라엘 전쟁에   방산주 계속 상승할 것 ,Economic
    리서치 부국장  이 팔 전쟁으로 인플레 높아질 위험  주시,Economic
 메리츠증권 직원들  가족 동원해 수십억 사익 챙겨   권영훈의 증시뉴스      ,Economic
 가계부채  대책 지적 빗발에 김주현 위원장  정책 모순 아니다  종합 ,Economic
에디슨 품은     결국 초소형 전기차 외면했다,Economic
올해 삼성전자 시총   조원  에코프로는  배 뛰어 투자    ,Economic
유광점퍼 입고 등장할까    구광모 회장  한국시리즈 참석 전망  김익환의 컴퍼니워치 ,Economic
 년 만에   대  이    대   됐다 국민평형도 제낀 이 아파트,Economic
