titles,category
대법  부마항쟁보상법 따라 보상받아도 위자료 따로 청구 가능 ,Social
이스라엘 단기체류    명 귀국    무사 귀국 다행 ,Social
도마 속에 수천억원치 필로폰 숨겨 밀반입한  개국 조직 검거,Social
 핫클릭   현실판 더글로리  학폭 고발 표예림 씨 숨진 채 발견  ,Social
선택과목 없애고 내신은  등급으로 사교육 조장 우려,Social
 어떻게 생각하세요 기아 노조  가족 고용세습  유지  공정성 논란,Social
난임 시술  년새       아이 낳으려는 부부에 지원 늘려야 ,Social
 순두부 커피 감자 커피  마시러 강릉 커피축제 가볼까 ,Social
정유정 반성문   번 제출했지만 재판부  반성인지 아닌지 헷갈려 ,Social
 조선업 유학생 비자  상반기  천명 목표였는데 발급은   건,Social
 무사히 돌아와 줘서 고마워    이스라엘 체류 국민    명 귀국,Social
겸직 금지 어기고 수억 번 유튜버 궤도  규정 잘 몰랐다 ,Social
 위니아 브랜드 믿고   억어치 물품 납품했는데 부도라니  ,Social
모텔 환풍구 속 수상한 카메라 영상    만 개 나왔다,Social
 삼성폰 점착제 제조법 유출  협력사 직원에   억 배상  판결,Social
 여자   명 죽이겠다  협박 글 쓴   대  아버지에게 효도하게 선처 부탁 ,Social
부산 기장에 국내 최대 반려동물 테마파크 생긴다      만 천  규모,Social
      미스코리아 진  최채원은 누구        플랫폼 미술감독이 꿈 ,Social
 자막뉴스   유명 연예인 마약 투약 목격  경찰에 다급한 신고 뒤   ,Social
 사반 제보  옥상에서 물 뿌리고 욕하는 여성   몇 년 동안 지속돼 ,Social
인생샷 찍으려다 주왕산서   대 추락사,Social
오토바이 지나자마자 펑 서산 상가 가스폭발로  명 중경상,Social
 사반 제보   여기가 너네 땅이냐  편의점 입구 막은 차량  무슨 일 ,Social
인천 폐기물 업체서   대 여성 지게차에 치여 숨져,Social
과학 유튜버 궤도   공무원 겸직금지  규정 어겨 징계 받는다,Social
김천 돈사서 불 돼지   마리 폐사,Social
 전화 안 받아    이혼  요구 아내 집에 화염병 던진 남편  집유 ,Social
 여성만   명 살해  협박글   대  효도할 수 있게 선처 부탁 ,Social
 춤추는 갈대밭 따라 피어나는 꽃   강진만 갈대축제   일 개막,Social
  월 열흘간 수출 줄고 수입 늘어 무역적자   억 달러,Social
 공교육 파행  사교육비 증가      혹평  나온      대입 시안,Social
제주항공  부산 보홀 노선   일 취항 필리핀 노선  개로,Social
차선변경 시비에 흉기 위협    잡고보니 술 마신 수배자,Social
고속도로 커브길서 넘어진   톤 화물차   대 운전자 사망,Social
 뉴스라이더   심신미약  검색했던 최원종  정신감정 신청   유족  엄중 처벌해야 ,Social
안성 물류센터 신축 현장서   대 작업자 추락해 숨져,Social
초진인데 사후피임약 비대면 처방 다이어트 한약 해외배송까지,Social
부산 기장군 국내최대 반려동물 테마파크 본궤도,Social
 말년병장 감동   알바생 찾았다  군인은 감사한 존재  자부심 가지세요 ,Social
질병청   오염수 전국민 장기추적 필요보고서 숨긴 것 아냐 ,Social
  보안업체    해킹조직  구조조정  협업 강화로 공격 다양화 ,Social
부산시  국내 최대규모  반려동물 테마파크  주민협상 전격 타결,Social
손수레 끌던   대 여성  음주운전 승용차에 치여 숨져,Social
 학폭 고발  표예림씨 숨진 채 발견 스토킹 의혹 유튜버  난 잘못 없다 ,Social
       딸 태우고 음주운전하려던 아빠 출동 경찰관까지 폭행,Social
강서구청장  시 투표율      지방선거보다       ,Social
서산태안시민행동  일본 핵 오염수 방류  홍범도 이순신 장군 본다면    ,Social
담양서 퇴직 간부공무원 실종 경찰 수색 중,Social
현대로템  우크라전 피난민 철도 운송 기여 우크라 정부 사의,Social
 갈수록 비싸진다  영어유치원     만원인데  만 명 다닌다,Social
영남이공대   경영회계계열   학번 김무영 씨  세무사 시험 합격,Social
 뉴스       이스라엘에 발 묶였던 우리 국민    명 무사히 귀국,Social
올해 미스코리아  진  누구  유학파 디자인 전공,Social
비 김태희 집 수차례 초인종 누른 스토킹   내달 첫 재판,Social
 이게 몰카였어   비데에 달고  공유기로 위장하고,Social
성동구 대형 슈퍼마켓서 화재 발생 같은 건물   명 대피,Social
한라산에도  첫 단풍  들었네 전국 청명한 가을,Social
서울대 경북대병원 노조  오늘부터 파업 돌입  의료 공공성 강화 등 요구,Social
현재 중 부터 선택과목 없애고 내신  등급     학년도 대입 개편안,Social
부산에   만  국내 최대 규모 반려동물 테마파크 조성 계획,Social
 나라 지켜줘서 감사  군인 울린  빽다방 알바생 은   대 여성,Social
 보궐선거  강서구청장 오전  시 투표율      직전 지선보다 낮아,Social
레벨테스트   세 고시 라 불린다 유아 평균 영어 학원비 얼마,Social
김태희 비 부부 집 찾아가  초인종 누르고 스토킹한   대     개월 만에 첫 재판,Social
 아파트 입주자 회장 되고 싶다 며 아파트선관위원장에 금품 준 후보,Social
  대 마트 업주가 단골 치마 속 도촬    발각되자 휴대폰 내리쳐,Social
  표예림 유서 속 유튜버  입장 공개  법적 공방에 위기감 느낀 듯 ,Social
파주시  초롱꽃마을 출판단지 잇는 심학산로 임시 개통,Social
 영상   흉기난동  최원종 정신감정 신청   형량 줄이려는 꼼수 ,Social
오늘부터 고령층 대상 독감 무료 예방접종 시작   세 이상 먼저,Social
 데블스 플랜  궤도  공공기관 다니며 영리 활동했다,Social
서울의   월 가을 밤 밝히는 빛 축제 열려,Social
  정부   가루쌀  보급 무리하게 추진 성과는 미궁 속,Social
 현실판 더 글로리  표예림 숨진 채 발견 고인이 지목한 유튜버  난 잘못 없어 ,Social
 전세보증금 떼일 걱정 마세요   울산시   보증료  지원,Social
   가 상속 분쟁  세 모녀 측 변호인  첫 변론 직후 사임,Social
서울대병원 무기한 파업 돌입  환자 불편 불가피 ,Social
추석 연휴 심야시간 틈타 강북 일대 빈 상가   여 곳 턴   대,Social
새벽 음주운전하다 행인 치어 숨지게 한   대 조사,Social
버스 타려다  음료 안 돼요  저지당하자  퍽  길바닥에 냅다 던진 남성,Social
전세계인에 감동주고     세 스카이다이버  할머니  하늘로 떠났다,Social
   구급대로 이송된 소아환자    명  병원서 문전박대  당했다,Social
새벽 서울 성동구 건물  층 슈퍼에 불   명 대피 소동,Social
이스라엘 단기체류 국민    명 귀국  무사히 돌아와 다행 ,Social
송도국제도시 공원 내  맨발 길  인기,Social
영어 유치원비      만원 졸업 후엔  레벨테스트  경쟁도 치열,Social
서울대       대입안에  큰 변화나 본고사 부활 없어 ,Social
같이 사는 친언니가 간섭하고 잔소리 반복하니 힘들다 마음상담소 ,Social
유튜버 카라큘라  반드시 책임 묻겠다  표예림 죽음에 가해자 응징 예고,Social
 여자만   명 살해  협박글 올린   대  효도 할 수 있게 선처 부탁 ,Social
 내일날씨  대체로 맑은 가을날 낮 최고      도,Social
이스라엘 단기 체류 한국인    명  인천공항 무사 귀국,Social
브릿지바이오  특발성 폐섬유증약    상 지속  권고받아 ,Social
낮 기온      도 맑고 일교차 큰 가을 날씨,Social
 흠집 난 과일 따로 상품화해 판매  수익 전액 아이들 위해 씁니다  나눔 실천하는 초록빛 능력자들 ,Social
연예인 약점 잡고  돈 내놔  김용호    일 구속심사,Social
부마민주항쟁 보상 받아도 정신피해 배상 인정,Social
성지순례 갔다가 봉변 이스라엘 체류 국민    명 귀국,Social
 이재명에   억 줬다  주장한 폭력배 박철민 최후 진술은 ,Social
이스라엘 체류 한국인    명 귀국  현지 상황 들어보니,Social
마음씨도 애국심도  최고  군인 감동 시킨  빽다방 알바생  찾았다,Social
서울대병원 노조  오늘부터 무기한 파업 인력 확충 임금 인상 요구,Social
 연예인이 마약했다  신고   경찰 출동하자      줄행랑  띵동 이슈배달 ,Social
  오염수 다  먹어라    여성 시의원  행사 중 폭행당해,Social
법정서     만원 전달 재연한 유동규 정진상 측    월에 양모 코트  ,Social
      국감 국회 교육위 국감 시작  김건희 논문  이동관 정순신 자녀 학폭 쟁점,Social
미   세 여성 스카이다이버  최고령 신기록  일 만에 사망,Social
   유권자 홍준표 이철우에 긍정적  일 잘한다               ,Social
 인터넷 와글와글  키아누 리브스   살 소년 요청에 캐치볼 게임 추억 선사,Social
 가족들 안도의 포옹  이스라엘 단기체류 국민 일부 무사귀국,Social
아내 딸 보이자 와락 이스라엘 단기체류 국민    명 귀국,Social
표예림 유서 영상  스토킹 유튜버  도 넘었다  지목 유튜버  우리 잘못 없다 ,Social
통합형       대입개편안   전문가  명확한 평가 가이드라인 필요 ,Social
오늘 법무부 국정감사 이재명 대표 수사 두고 여야 공방,Social
 속보  이스라엘 성지순례 우리 국민    명 무사 귀국,Social
홀덤펍에서 술 안팔아도 청소년은  출입금지 ,Social
올해 경북서  진드기병 으로  명 사망 야외활동 조심,Social
 필수 의료 인력 충원하라    경북대병원 노조   년 만에 총파업,Social
 음료를 바닥에 내동댕이  음료 들고 버스 타려던 승객  무슨 일 ,Social
영어 유치원비  서울보다 비싼 지역  곳 어디 ,Social
 외제차 팔아 투자금 내놔  감금 폭행한   대 징역  년,Social
 강제 추행  처벌받고도 정신 못 차린   대  알몸으로 동년배 식당 주인 건들다 징역,Social
 이별 통보에 분노  본인 집에 불지른   대 검거,Social
 필수 의료 인력 충원하라    경북대병원 노조   년 만에 총파업,Social
 음료를 바닥에 내동댕이  음료 들고 버스 타려던 승객  무슨 일 ,Social
영어 유치원비  서울보다 비싼 지역  곳 어디 ,Social
 외제차 팔아 투자금 내놔  감금 폭행한   대 징역  년,Social
 강제 추행  처벌받고도 정신 못 차린   대  알몸으로 동년배 식당 주인 건들다 징역,Social
 이별 통보에 분노  본인 집에 불지른   대 검거,Social
 인터넷 와글와글  박서준  더 마블스    월  일 개봉  얀 왕자 의 존재감,Social
이 팔 무력충돌로 발 묶였던 국민    명 이스라엘서 무사 귀국  뉴시스    ,Social
대법  포괄임금제여도 수당 뺀 기본급이 최저임금보다 높아야 ,Social
이동재 전 기자  정준희 교수 등  명예훼손  고소,Social
 이재명에   억원 줬다  주장한 조폭  최후진술 들어보니,Social
재혼 실패하는 이유  돌싱   기대감 너무 높아    는 ,Social
 고등 교사가 학생 폭행   분리조치  없어,Social
코인 투자로 빚더미 앉은 남편  이혼 요구에  빚도 분할 대상 ,Social
 친일파들 오염수 다  먹어라  국민의힘 고양시의원  괴한에 폭행당해,Social
오늘 법무부 국정감사  이재명 영장  최대 현안,Social
  대의 어긋난 로맨스  접근금지 무시하고 또 다시 스토킹,Social
 영상   길에 탱크  공항은 마비  이스라엘 탈출    여명 무사 귀국,Social
영어유치원비 월    만원  교육 불평등 심각 ,Social
 누에 치는 왕비의 재림  서초구  년만에 잠원나루축제,Social
비데에 카메라 달고 셀카봉으로 옆방 찍고 불법 촬영 증가세,Social
광주 수완 지하차도 입구서     들이받은 오토바이 운전자 숨져,Social
 조리돌림 당했다  표예림 유서에 지목된 유튜버   내가 피해자 ,Social
반말에 폭언까지 배달노동자 절반  고객 업주로부터 갑질 당해,Social
중증정신질환자 느는데 센터 정신건강전문요원 비중 되레  감소  병원 밖 정신질환자 ,Social
 희망이 현실로    회 강제입원  중증 정신질환자의 자립 성공기 병원 밖 정신질환자 ,Social
이스라엘 여행한 유튜버  현재 다른 나라  난 안전해 ,Social
인천 고잔동 폐기물공장   대 노동자 지게차 치여 숨져,Social
 비행기 언제 뜰까 생각만  귀국 국민들 전한 이스라엘 상황,Social
음주운전 신고 포상제 시행 한 달째  현장은 ,Social
 주식 코인 실패한 남편  이혼하면  억 빚 분할하겠답니다 ,Social
 보궐선거  강서구청장 오전  시 투표율      직전 지선보다       ,Social
 무사 귀국 실감  이스라엘서 우리 국민    명 입국,Social
정유정 반성문   번 제출했지만 재판부  반성 맞나 헷갈릴 정도 ,Social
 나체로 뒤에서 끌어안아   식당 주인 추행 혐의   대 징역형 선고,Social
      국감 오늘 법무부 국감  한동훈 책임론  공방  예고,Social
장출혈인데  치루 수술  받고 사망 유족   오진  의사 이례적 구속에도 분통,Social
이스라엘 단기 체류 한국인    명 무사 귀국,Social
   오염수 너희가 다 먹어라  친일파  들아   국민의힘 고양시의원 폭행당해,Social
  시  땡  하자 투표소로 발걸음   시부턴 대기줄  투표열기 후끈,Social
  대 외국인  모텔 객실  곳에  몰카      명 당했다 ,Social
이스라엘 체류 한국인    명 귀국 가족들과  감격의 포옹 ,Social
인천 공장서   대 노동자 지게차 치여 사망,Social
  억 원대 가상화폐 사기 수사 무마 청탁한   대 구속,Social
이 팔 사망자     명 넘어 가자지구 공습 계속 뉴스쏙 속 ,Social
검찰   영아 살해 화장실 유기    대 친모 징역  년 구형,Social
용산구 버스정류장 도배된 최   주무관 누구 ,Social
술에 취해 난동 피우고 출동 경찰관 폭행한   대 체포돼,Social
이스라엘 단기체류    명 우선 귀국    무사히 귀국해 다행 ,Social
학부모 대상 공개수업 줄줄이 취소 대전에서 무슨 일이,Social
 낙하산  관광공사 부사장  용역 심사위원 선정 부당개입 의혹,Social
 대입 개편 수능은 계속 오지선다형 논 서술형 개편 다시 추진할까,Social
새만금 예산     억원 돌려주오 전북서  삭발에 단식  아우성,Social
수도권매립지 내 폐기물  꼼수  반입 차량 수백대 적발,Social
 단독  청소년 마약 폭증에도 전문위 회의는 달랑  두 번 ,Social
설탕도  소금도  년 만에 최고치 상승   외식 물가 더 오르나 ,Social
 단독 최중증 발달장애인  만명  정부 돌봄서비스 대상은    그쳐,Social
새벽에 음주운전하다가 행인 치어 숨지게 한   대  경찰 잡고보니,Social
     만원 영어유치원 다음은   세 고시  사교육 광풍,Social
청송 주왕산서 기념촬영하던   대 참변,Social
기아 노조    일부터 파업 돌입  고용세습  조항 놓고 갈등,Social
 피해 분담금 더는 못 내겠다  애경  행정소송까지 진행,Social
영어 유치원비 한달    만 원 졸업하면   세 고시  레벨테스트,Social
 나라 지켜줘서 감사  군인 울린  빽다방 알바생  찾았다,Social
이스라엘 단기체류 국민    명 귀국  무사히 돌아와 다행 ,Social
   월   일생  주민번호   도장 엉터리 대담한  회장님 ,Social
대법  부마항쟁 보상금 받았더라도 정신적 손해배상 가능 ,Social
 나라 지켜줘 감사  말년병장 울린 감동카페 알바 찾았다,Social
서울대병원 경북대병원 노조 오늘부터 파업   의료 공공성 강화 등 요구,Social
육군 병장 감동시킨 알바생 찾았다  군인의 희생 당연하지 않아 ,Social
 뉴스딱  합격했는데  년째 백수 대기 중인 지방공무원      명,Social
 무사히 돌아와 다행  이스라엘 체류 국민    명 귀국,Social
    타고 온 소아환자에  전문의 없어요    작년에만    건 육박,Social
브랜드명까지  한글  이제 대놓고 베끼는  짝퉁   푸드 ,Social
가정폭력 아빠 피해 옮겼는데 어린이집 퇴소 거부당했다,Social
 청담동 주식부자  이희진  이번엔 코인 사기 투자자 속이는  스캠 코인  해부,Social
     억 원어치 마약  도마 에 숨겨 국내로 경찰   개월 수사 끝에 국제범죄조직 검거,Social
서울대병원 노조  오늘부터 파업  인력 확충     응급실 등 필수인력은 유지 ,Social
 아침신문 솎아보기  한겨레  인터넷언론사 심의 불능 의견 직후 법무팀 인사 전원 교체 ,Social
 아는 것이 힘 갑자기 한쪽 귀만 먹먹할땐  돌발성 난청  의심을,Social
영어 유치원비 한달    만원 졸업후엔   세 고시  레벨테스트도,Social
 강제추행  벌금형 받은   대 두달 만에 또,Social
새마을금고 광주전남본부  내부횡령   억여 원  고양이에게 생선 맡긴 꼴 ,Social
 전쟁 터져 가슴 철렁 무사히 돌아와 다행  이스라엘서 귀국 여행객들,Social
 관련 규정 몰랐다  과학 유튜버  궤도    겸직 규정  어겨 징계 불가피,Social
불법체류 단속하다 다친 공무원 급증 작년  명 올해   명,Social
국민연금   년 가입자 월 평균    만원 받는다      는 아직    만원 미만 ,Social
 화장실 비데에 카메라 달고 셀카봉으로 모텔 투숙객 촬영,Social
     원 꼭 갚을게요  돈 부족한 초등학생들에게 음료 내어준 사장  잇슈 키워드 ,Social
 잇슈 키워드   서이초 학부모  범죄 혐의  발견 못 해  수사 마무리될 듯,Social
서울대 경북대병원 오늘부터 무기한 파업 진료 차질 불가피,Social
 잇슈 키워드   호기심에  모텔 돌며  몰카  설치한 중국인 구속,Social
대법  부마항쟁 보상금 받았어도 정신적 손해배상 청구 가능 ,Social
        서울 강서구청장 보궐선거 오늘 본투표  ,Social
 가족과 끌어안고 눈물  이스라엘 체류 국민    명 인천공항 도착 ,Social
강제추행 집유기간에 또 옷 벗고 식당 주인 끌어안은   대,Social
 굿모닝브리핑  광명역 침수 피해  년 지나 복구   중국산 부품 수급난,Social
 이 팔 전쟁  이스라엘 단기체류 국민    명 귀국  무사히 돌아와 다행 ,Social
이스라엘 출발    명  인천공항 도착  무사히 와 안도 ,Social
차 사이로  불쑥  아이 안고 무단횡단한 여성  항의하자  서행하라 ,Social
법인 어린이집 열에 셋은   년 넘은 노후 건물  안전점검도 있으나마나 ,Social
객실 천장에  몰카     여명 투숙객 불법촬영   대 구속,Social
권익위  이재명  법카 유용 알았을 가능성  대검에 이첩,Social
 탈의실 신발장 구멍서 불빛  반짝반짝  경비원이 몰래 찍었다,Social
연     만원 장학금 준다는데 의대생  공중보건장학제  참여 저조,Social
음료 들고 버스 타려다 거부당하자 길바닥 내동댕이쳤다,Social
버스 타려다  음료 안 돼요  저지당하자  퍽  길바닥에 던진 남성,Social
 이름바꾸고 대박났다구   신간도서 발간,Social
 개월 아들 방치해 심정지   대 친모  심도 징역   년 구형,Social
 불가능한 일반 예약  테니스코트  황금시간대 는 동호회 차지,Social
  억대 가상자산 사기   대 구속  브로커  수사기관 지자체 영향력 행사 수사 ,Social
  오염수 너희가 다  먹어라  국민의힘 의원  괴한에 폭행당해,Social
한국인 여행객    여 명 인천공항 도착,Social
선택과목 사라지는 사탐 과탐 심화수학은 사교육 조장 우려,Social
 조리돌림 당했다      표예림씨가 저격한 유튜버 반박,Social
 이사람  이주호  교육개혁 시동  대입 두축  수능   내신  개편,Social
매경이 전하는 세상의 지식  매 세 지    월   일 ,Social
광안대교 야경 있고  술판 없고 확 달라진 민락수변공원,Social
등으로 떨어졌는데 이웃 계단서 살해한 혐의   대  무죄   왜,Social
 대입 개편    등급제  자사 특목고 쏠림 되레 심해질 것  엇갈린 교육계,Social
 단독  띵동  통계청입니다  친절한 조사원들  사실  문 뒤 가 두렵다 국감     ,Social
 년 차 연봉     만원   세대가 험하다는 인테리어 시공 현장에 뛰어든 까닭은,Social
 더 한장  중국   대들의 탕핑     반란  변신 걸상 교실의 진화 ,Social
 실종자 찾아요  문자 발송   분 만에  택시기사 눈썰미 ,Social
서울대병원 경북대병원 오늘부터 파업 돌입  진료 차질 불가피 ,Social
 사라져   죽었다   산 채로  푸들 생매장 견주의 거짓말 사건의 재구성 ,Social
 내일 총선이라면  국민의힘       민주당        서울 국민의힘  인천경기 민주당  강세 ,Social
말년병장 울린 그  빽다방 알바생  찾았다   군인들 자부심 가졌으면 ,Social
울어야  진짜  데이트폭력 피해자  틀렸습니다,Social
 굿클리닉 치매 주범  알츠하이머병     영양제 효과 없어 생활습관 개선 더 중요,Social
내신  등급 수능 선택과목 폐지 현 중 부터,Social
모텔서 신생아 던진 친모 체포  영아 살해 ,Social
오진 탓에 사망했는데 소송에 속터지는 유족들,Social
김행  대기실에 있었을 뿐 행방불명 결코 아냐       공개 요구,Social
사고 현장 덮친 버스  차 사고로  명 사망,Social
명동 거리  가격 표시제  실시   바가지 사라졌을까 ,Social
 수도권은 과밀  지방은 부족  병상 불균형도 가속화,Social
교사에 항의한 학부모 아이 항문에   묻어있어서,Social
 군인들 자부심 가졌으면  육군 병장 감동  알바생  찾았다,Social
신호 걸릴 때마다  후루룩   안쓰럽다   위험한 행동 ,Social
 오늘 아침 신문  노벨상이 주목한 성별 임금 격차      년째  위 개선 속도도 더뎌,Social
 이재명에   억 줬다  주장  조폭  박철민의 최후 진술 어땠나,Social
 나라 지켜주셔서 감사  군인 감동시킨  빽다방 알바생  찾았다,Social
이스라엘 체류 국민 중    명 인천국제공항 무사히 도착 종합 ,Social
    에 잡힌 가스 폭발  명 중경상,Social
오늘부터   세 이상 고령층 독감 무료접종 시작,Social
현재 중 부터 내신  등급제 수능 문 이과생  공통 과목 ,Social
강제추행 벌금형 받은 지 두 달여 만에 식당 주인 추행한   대,Social
김동연표  초등생 아침급식 제공  사실상 무산 도교육청  공약서 제외,Social
재산 축소 신고해  사회통합 전형  합격  합격 취소 ,Social
 외모 불량해 불합격  유명 특성화고  입시조작  수사,Social
 사교육 확대 우려   취지에는 공감  교육계 반응은 ,Social
흐느껴야  진정한  데이트폭력 피해자   통념으로 판단 안돼 ,Social
의대생   천만원 장학금 안 받을래요  무슨 일 ,Social
학폭 피해 폭로 유튜버  부산서 숨진 채 발견,Social
한국인 여행객    여 명 인천공항 도착 예정,Social
한국인 철수 시작 잠시 후 인천공항 도착,Social
이재명 영장 기각  주    고심 끝  위증교사  분리기소 가닥,Social
선택과목 모두 없애 유불리 원천 차단  변별력 확보는 어떻게       대입 개편 시안 ,Social
 한동훈    야당  오늘 법무부 국정감사서  이재명 수사 로 격돌,Social
 조센징 국기 볼 때마다 화나  태극기 불태운 누리꾼 조사,Social
러 스파이와 첩보전 펼친 북유럽  국 공영방송 승리 비결은 ,Social
서울대병원   무기한 총파업  돌입 진료 수술 차질 우려,Social
  정부  내년도 희귀질환 지원 사업    억 삭감 논란,Social
신라젠  이젠 결과물로 말할 것 올 하반기부터 가시화  인터뷰 ,Social
     대입제도 개편 시안  특목고 자사고  쏠림 우려,Social
 택시랑 비슷하네  지하철 요금 인상  발길 무거운 출근길,Social
만취 귀가 꾸짖은 모친 살해 대학생 아들 첫 재판,Social
오늘 법무부 국정감사  영장기각  이재명이 최대 현안,Social
대법  부마항쟁 보상금 받은 피해자도  정신적 손배소  가능 ,Social
신생 자영업자 노리는  광고 사기  여전 포털 상단 노출  인플루언서 홍보로 끌어들여,Social
 아빠가 중요부위 만졌어요   알고보니   살 딸은 일기장 달달 외웠다,Social
국내 업체 가습기 살균필터서도 독성물질 환경부는 숨겼다,Social
 학부모와 골프를  전교생  배 이상 늘어난 경북 당포초,Social
   명이 당했다 모텔 돌며  몰카  설치  불법촬영한  간큰  중국인,Social
   억 뇌물  이정근 항소심 오늘 선고     사실상 감형 요청 ,Social
 이슈     국민연금 월   만    만원 신규수급자 가입기간은 평균   년,Social
