titles,category
 유석재의 돌발 전  전래동화  알고보면 호러물이었다고 ,Culture
 라인  날씨  내일 아침도  쌀쌀  큰 일교차,Culture
자고 일어나면 오르는  설탕값   탕후루  지금 떨고 있니 ,Culture
    검사 통해 아이 아빠 추적 남성도 양육 책임지는 부성애법 강화 필요,Culture
 날씨  올가을 들어 가장 쌀쌀   내륙 기온 뚝  설악산 첫 영하권,Culture
이 정도면  예스 재팬  맥주 수입국  위 자리 되찾은 일본,Culture
 궁금해서   기생충 득시글한 생선 먹은 남성  결국,Culture
 파르르  눈가 떨림   이 증상  동반되면 안면마비 위험,Culture
 뉴스  날씨  내일 아침도  쌀쌀  큰 일교차,Culture
 날씨  올가을 들어 가장 쌀쌀   내륙 기온 뚝  설악산 첫 영하권,Culture
노벨문학상에  아침 그리고 저녁  노르웨이 거장 포세 종합 보 ,Culture
김수현이 복기한 문재인 정부 부동산정책   문제는 금리였다 ,Culture
 나  가을 타나봐  계절성 우울증 극복하고 싶다면 ,Culture
 날씨  내일까지 때이른 추위 출근길 안개 살얼음 유의,Culture
유인촌     때  블랙리스트  없어 백서에    번  왜 구속 안했나  종합 ,Culture
     억원 기부  따거 주윤발  제게 필요한 건 쌀밥 두 그릇 ,Culture
줄기세포로  형 당뇨병 치료 가능성 높아져,Culture
 결핵    년 만에 증가세 기침 가래 증상이기에 일반 호흡기 질환과 구별 어려워,Culture
당뇨 전 단계일 때  체중 보다  이것  줄이세요,Culture
사적으로 해외 단체 관광객 모객한 유명 여행 유튜버  결국 ,Culture
 날씨  내일까지 때 이른 가을 추위 출근길 안개  강원 내륙 산지 도로 살얼음,Culture
독감 백신 맞은 후 운동해도 괜찮을까 ,Culture
불안감 밀려와 가슴이  턱    일상생활 어렵다면 ,Culture
 날씨  내일 출근길 더 쌀쌀 해안가 강풍주의,Culture
    억 기부 주윤발  남대문서 밤마다 번데기 사먹었어요 ,Culture
초코파이 맛이   가지나 된다고  한국보다 더 인기라는  이 나라 ,Culture
부산의 영웅본색     억과 쌀밥 두 그릇,Culture
방탄소년단 뷔   가 뜨니  과연 서울관광이 날았다,Culture
부산 골퍼들의  비밀 정원  금잔디 밟을 수 있는 국내 유일 골프장,Culture
방심위 소위       뉴스타파 인용보도        윤석열 커피 보도  징계 의결,Culture
남성 난임 급증  건강한 정자 지키는 법,Culture
유인촌  백서 내용  상당히 명예훼손적    번 거론하고 왜 구속 안했나 ,Culture
 날씨  내일까지 때이른 가을 추위 곳곳 서리 얼음,Culture
유인촌     정부 블랙리스트 없었다   아빠 찬스  의혹도 공방,Culture
운동만으로 다이어트 성공할 수 있나  전문의 답변은,Culture
방심위   뉴스타파 인용     에도 중징계  과징금 부과  전망,Culture
 복원 마무리  광화문 앞 월대   일 공개한다  함께 걷는 길로 ,Culture
 생활날씨  내일 아침 더  쌀쌀  곳곳 서리  얼음,Culture
 낳고 싶어도 못 낳는다     년간  불임 환자 증가,Culture
 의외로 칼로리 높네    와인 끊으면 생기는 몸의 반응,Culture
 흡연 없애 질병 원인 차단    총리 제안 무리수일까 ,Culture
 날씨   패딩 꺼낼까  내일 아침  더 추워져,Culture
            영원한 따거 주윤발      억 기부 아내가 결정 하루 쌀밥 두 그릇이면 충분 ,Culture
 한국에 전 세계 최초 출시       신형  시리즈  첫선,Culture
 단독  현대차가 준비중인 비밀병기 정체는 업글로 진화하는  이것 ,Culture
 내일날씨  아침 최저기온  도 밑으로  쌀쌀한 가을 계속,Culture
 날씨  올가을 들어 가장 쌀쌀   내륙 기온 뚝  설악산 첫 영하권,Culture
중증 화농성한선염  엄격한 산정특례기준에 환자들은 속앓이 극복해요  희귀질환 ,Culture
유인촌  나를 반대하는 분들  예술인 아닌 문화행동가들 ,Culture
 참치캔은 무슨 죄     초등 조카에게 먹였다  혼쭐   무슨 사연 ,Culture
 날씨  내일까지 가을 추위 중부 내륙 서리  얼음,Culture
오늘 체감온도  도  깜짝 추위   주말까지 추위 이어져,Culture
커지는 타이어휠 쏘나타가 옛 에쿠스 맞먹어,Culture
 단독  현대차 기아    서  비밀병기  내놓는다,Culture
비싸다고 좋은 걸까  비타민  영양제  똑똑하게 고르는 법,Culture
 스브스픽  주윤발      억 전 재산 기부 질문에  아내가 한 건데  진짜 돈 없다 ,Culture
캐딜락    월 한 달 전 차종 무이자 할부 혜택  최대   개월 적용,Culture
 만화를 그린 덕분에 살았네요    도박 중독자의 가족  이하진 작가  플랫 ,Culture
귀가후 할 일  외투 꼭 챙기세요 ,Culture
한국인 남편에 매인 그녀 고소득  위 올랐던  여배우 변신,Culture
 냥이 집사 되려다   호흡곤란 죽을 뻔한  여성  왜 ,Culture
일반인도 할 수 있는  다이어트 끝판왕  아시안게임 종목,Culture
유인촌  블랙리스트 재조사  한다면 노무현 문재인 정부까지 ,Culture
             국토부  양평고속  대안노선  경제성 더 높았다 ,Culture
망고 바나나의 맛  이상한 과일  포포 를 먹어봤습니다  식후감 ,Culture
밤마다 뭐 먹고 싶다면     브로콜리 테스트  해보세요,Culture
유인촌 청문회 아빠찬스 블랙리스트 놓고 공방 종합 ,Culture
부산 찾은  영원한 따거   영화 없이 주윤발도 없어 나이듦 두렵지 않아 ,Culture
유인촌  아들이 내 후광을 입어  현실을 잘 모르시는 것 ,Culture
 단독       시리즈 전기차  호 주인은 삼성   ,Culture
 날씨  쌀쌀한 퇴근길 내일 아침까지 가을 추위,Culture
전세계 홍수 위험 주거지      증가  그래도 계속 짓는 이유,Culture
           판빙빙이 직시한  녹야   여성이여  두려워 말라 ,Culture
 날씨  올가을 들어 가장 쌀쌀   내륙 기온 뚝  설악산 첫 영하권,Culture
주름질 만큼  질끈  감아야  단  초  안구건조증 막는 이 습관,Culture
물 안 마시고 화장실 참다가  옆구리 쿡쿡  콩팥은  비명 ,Culture
간 영양제  진짜 피로 회복에 도움 될까   건강 의피셜  ,Culture
중년 주부가 달걀 두부 꼭 먹었더니  놀라운 변화가 ,Culture
 탈세  공백 후 복귀한 판빙빙  스스로 침잠한 시간 나만의 콘텐츠 쌓아 ,Culture
돌연 대관 불허된 부산반핵영화제     친원전  윤석열 정부 눈치보기 ,Culture
    사장 임명 제청 난항 여권 이사  명 사의 표명,Culture
이번주 토요일 여의도 세계불꽃축제  도로 통제 구간 미리 확인하세요 ,Culture
    억원 기부한 주윤발  난 쌀밥 두그릇이면 충분 ,Culture
  월 말 시작하던  서리주의보 가 벌써  내일 체감온도  도 ,Culture
 밤 악취 못 잡고  농도에만 집착  행정 협조 부족    꽉 막힌 냄새관리  출구 없는 사회적 공해 악취 ,Culture
국물은 붉은데  매운맛은  도 없다   라면이 설마 ,Culture
 따거  주윤발 클래스는 영원하다,Culture
 추석 때 시킨 택배 언제 옴   오늘이 택배사엔 추석 물량  피크 ,Culture
경찰기마대 헌신한 말  팔면 끝   최소한의 예우 복지 필요 ,Culture
 실종설  판빙빙  공백기  마음 가라앉힌 시간   누구나 삶의 기복 ,Culture
한달간   대 팔았다 현대차에 무슨 일,Culture
요일제 공휴일 시행되지 못하는 이유는  궁즉답 ,Culture
 실종설  나돌던 판빙빙  색다른 경험했다  주윤발   영화 부상 고무적 ,Culture
 내일 날씨  오늘보다 더 춥다  체감 온도  도 안팎 곳곳 얼음도,Culture
유인촌  두 자녀 아파트 매입 관련 증여세 납부했다 ,Culture
가을만 되면  훌쩍  알레르기로 고생한다면 이 시간엔 환기 피하세요,Culture
유인촌  블랙리스트 재조사  이왕 한다면 노무현 문재인 정부까지 ,Culture
몇 개월 동안 집에서 발만 동동 내년부터 상급종합병원 간호사  같은 기간 면접 시행,Culture
유인촌     정부선 블랙리스트라는 말 없었다 ,Culture
비엣젯 항공  부산 푸꾸옥 직항 노선 개설,Culture
영웅본색의  따거  주윤발   후회는 없다    큰형 의 면모  엄형준의 씬세계 ,Culture
비만 당뇨 충치 유발  탕후루  국회에 소환 당했다,Culture
블랙핑크 리사  누드쇼  논란 정면돌파  언제든 불러달라 ,Culture
샤워 귀찮다고 허리 숙이고 머리 감으면   허리 목 눈 건강에 치명적   헬스톡 ,Culture
 기고  시행령의 고향사랑 기부제  꼬리가 머리를 흔들다,Culture
주윤발  사망설 신경 안써      억 기부는 아내가     따거 의 품격,Culture
부여 가림성서 성벽 관통하는 배수로 확인  백제 기술력 가늠 ,Culture
    사장 선임 난기류 여권 이사  명 사임,Culture
    프리미엄 세단  뉴  시리즈  세계 최초로 한국서 출시,Culture
유인촌     정부 시절 블랙리스트라는 말도 없었다  영상 ,Culture
따뜻한  따거  주윤발  늙는 것 무섭지 않아  그게 인생 ,Culture
 더뉴스  제  회 부산국제영화제 개막   올해 볼거리는 ,Culture
유인촌  이명박 정부 때 블랙리스트라는 말도 없어 ,Culture
 단독  야생으로 돌아간 남방큰돌고래 삼팔이  세 번째 새끼 낳았어요 ,Culture
중형     왕좌 경쟁  쏘렌토  싼타페에 압승,Culture
 그립습니다  윤강희 대구 서구청 홍보팀장의 아버지 고 윤진구 씨 어머니 고 양영자 씨,Culture
추석 뒤끝   월급 빼고 다 오른다  식음료 값  도미노  인상,Culture
다리에 있는  심장      종아리근육 얕보지 마라 ,Culture
환절기  불청객  알레르기 일상생활 곤란할 정도라면 ,Culture
 블랙리스트 의혹  유인촌  없었다  혹은  안했다  모든 의혹 부인,Culture
 오늘 퇴근 후 집까지 걸어 올라가세요    계단  층 오르면 심혈관질환 발병률 ,Culture
월가는 사라는데    아마존 전기차  리비안 급락한 이유는 ,Culture
 따거  주윤발  영화 없으면 주윤발도 없다  영화 경쟁력은 창작의 자유  부국제      ,Culture
주윤발  주름 생기는 것  전혀 걱정 안 해    영화 없었으면 나도 없었을 것 ,Culture
셀트리온헬스케어  유플라이마   미국 인구의    에 처방한다,Culture
  엔솔  토요타도 잡았다 북미 공략 가속 페달,Culture
악취관리  년째인데 민원 최다    제주 양돈업계 향한 뿌리 깊은 불신  출구 없는 사회적 공해 악취 ,Culture
화사  한 달간  이것  마셨다가 얼굴 부어  이유 뭘까 ,Culture
영탁  에너지 비결로 매일 아침  이 운동  꼽아  실제 효과는 ,Culture
유인촌  자녀 증여세 탈세 의혹 부인  세금 모두 납부 ,Culture
데이비드 베컴  오래 앓은  강박장애  고백  어느 정도인가 봤더니 ,Culture
유인촌  두 아들 아빠찬스 의혹에  많이 억울해할 것 ,Culture
    이사회 여권 이사  명 사퇴 의사 밝혀 사장 임명제청 난항,Culture
유인촌  욕한 적 없다  언론자막 때문에 오해받아 ,Culture
한 달 새  만대 팔렸다 싼타페 제치고  위 오른    돌풍 ,Culture
 훈민정음  해례본 언해본 옛 모습 최대한 살린 복간본 나온다,Culture
 책으로 만난 사람  피눈물 흘린 전세사기 찐 극복기  웹툰으로 그려 전세역전 ,Culture
홀란드도 한다는 수면 입테이핑  전문가들  코 호흡은 좋지만    ,Culture
 장롱 속 겨울옷 어디있더라    내일 아침 출근길  체감온도   도  뚝,Culture
 날씨  올가을 들어 가장 쌀쌀   내륙 기온 뚝  설악산 첫 영하권,Culture
 날씨  찬바람에 기온  뚝  설악산 올가을 첫 영하권,Culture
유인촌     정부 시절 블랙리스트란 말도 실체도 없었다 ,Culture
모더나  올해 변이 항체회피 강해 고위험군 신규 백신 맞아야 ,Culture
 순한맛 좀 볼래   불혹  안성탕면  순하게 변신했다,Culture
유인촌     정부 시절  블랙리스트  절대 존재하지 않았다 ,Culture
권순우 비매너 독됐나 유빈과 공개열애  개월 만에 결별,Culture
 오후날씨 꿀팁  오후에도 선선 호남 해안 제주 강풍 주의,Culture
유인촌  자녀 주택구입 증여세 납부 완료 계산하면 다 맞다 ,Culture
머릿속에서 떠나지 않는 불안감 어떻게 조절할까,Culture
   년전 훈민정음 해례본 언해본 첫 동시 복간,Culture
    이사회 여권 이사  명 사퇴 사장 임명제청 난항,Culture
 자막뉴스  한반도  지옥문  열렸다   인공지능이 분석한 강수 변화,Culture
 괜히 전기차 샀나  더 후회하겠네 중고차값 더 떨어질듯  원인은 ,Culture
 단독  영화로  유통 히어로  꿈꿨지만 신세계  일렉트로맨 청산 ,Culture
유인촌  왜 저를 구속 안 시켰는지 궁금 ,Culture
사람의 소리로 가득 찬 세상  인류 종말 시계 앞당긴다  주말엔 책 ,Culture
올가을 가장 추웠던 오늘 아침    내일은 점퍼 입어야 할 수도,Culture
추석 때 먹다 남은 음식   이렇게  먹으면 식중독 위험,Culture
유인촌 인사청문회 직전까지도 보수 진보 예술계   대결 ,Culture
   도 같이 왔어요        세대   시리즈  세계 최초로   출시,Culture
캠핑장서 숨진채 발견된   대 남녀 시체가 말을 걸어왔다        ,Culture
 소중이 털 이 더 곱슬인 이유   이것  때문에 더 강해져서 ,Culture
명절 자체가  스트레스  명절후유증  원인과 대처법은 ,Culture
거울 속 얼굴  비대칭   남들 눈에도 그럴까 ,Culture
살 빼도  뱃살  안빠지면   당뇨엔 도루묵  어떻게하나 ,Culture
 판매량 왕좌 못내준다  쏘렌토  싼타페에  기선 제압 ,Culture
권순우 유빈 결별 공개 열애  개월 만에,Culture
아우디코리아는 판매 대리점  소비자들  구입 후회  원성,Culture
    혁신의 아이콘  뉴  시리즈  세계 최초   상륙,Culture
코로나   사망률   남성이 여성보다 높은  이유  나왔다,Culture
  년대 킹카들의 스트리트 패션  찐 바이브  대방출 옛날잡지 ,Culture
불황기에는 직원을 줄여야만 할까   사장의 별의 순간 ,Culture
 요즘 누가 출근룩 정장 입어   남성복브랜드 앞다퉈 내놓는  이것 ,Culture
      세대  뉴  시리즈  전 세계 최초 국내 출시  가격     만원부터,Culture
조선 선비들이 무당과 경쟁한 이유,Culture
 환절기 감기 조심  우리 댕냥이 가을철 건강 관리법은          반려동물 ,Culture
출시도 안 한 테슬라  사이버트럭   경매에 나왔다,Culture
매일  분씩 집안일만 해도 조기 사망 위험     뚝,Culture
김수현의 고백   문재인정부가 집값 못 잡아 국민이 좌절  분노 ,Culture
한국 치킨 얼마나 맛있길래 미국 절반에 깃발 꽂았다,Culture
 우문우답 하는 챗   시대  교회는 근본적인 해답 준비해야 ,Culture
 화재 가능성   개 차종     대 제작 결함에 리콜,Culture
     뉴  시리즈  전 세계 최초 국내 출시,Culture
 년만에 돌아온      시리즈 한국서 최초 출시,Culture
 삼성페이 만 있으면 주민등록등본 발급  전자증명서 서비스 지원,Culture
올 가을 들어 가장 추워 일부 영하권 기온,Culture
무릎 통증 완화하고 연골 재생시킨다는  자가골수줄기세포 주사   원리는 ,Culture
 약손   폐암의 진단과 치료  미세먼지와 폐암,Culture
화사 공연이 정말 테러였을까,Culture
    신형  시리즈 국내 출시 기본트림   만원 ,Culture
몸에 생긴 멍울  암일 때는  이런 특징  있다,Culture
 마라톤 고수도 걷기부터 시작  달리려면 걸어라  양종구의    세 시대 건강팁 ,Culture
     날씨  오늘 아침  올가을 들어 가장 쌀쌀 강풍 주의,Culture
  에너지솔루션    도요타와 배터리 계약,Culture
신형      시리즈  전 세계 최초로 국내에서 출시  가격     만원부터,Culture
벤틀리 벤테이가      연료공급장치 문제로 리콜,Culture
 책  오늘도  명이 퇴근하지 못했다,Culture
부여 가림성서 백제 통일신라 조성된 성벽 배수체계 발견,Culture
 선장  없는 부산국제영화제 그래도 닻은 올렸다,Culture
 영양없이 열량만 높다    이런 음식 어떻게 구분할까 ,Culture
     뉴  시리즈  한국 상륙,Culture
알뜰교통카드     기후동행카드 뭐가 더 저렴할까   머니줍줍 ,Culture
 날씨  아침 기온 뚝   낮에도 선선 전국 강풍 주의,Culture
  엔솔   위 토요타에 배터리 공급  단일 수주 최대규모 ,Culture
지하철 버스 타는 것도 겁난다 교통비 아끼는 필살기  머니줍줍 ,Culture
도요타 미니밴 알파드 개발 이끈 엔지니어  고급 세단을 넓혔다 ,Culture
   년 전 비해 의사합격자는 증가했는데  공중보건의사는     명 줄어 ,Culture
채식주의라면서 몰래 치킨     이 유전자는 고기를 원한다 ,Culture
어르신들 진통제 먹고 운전했다간   교통사고  배 위험,Culture
때론 맵게  때론 달게  입맛 살리는  파씨 가문  이우석의 푸드로지 ,Culture
차이나타운 찍고 순대거리 누비고  골목골목  미식 탐방 ,Culture
원폭 그림자 뒤에  숨겨진 협곡   기암 폭포 소 지나    속으로 박경일기자의 여행 ,Culture
이기우  지옥같은 펫숍 봤다면    동물을 어떻게 사고파나요   인터뷰 ,Culture
 애착 집사 쟁탈전   다묘가정서 자리 쟁탈전 벌어지는 이유는  ,Culture
다 우리 탓     지자체 공무원 악취담당  인센티브 줘도 기피  출구 없는 사회적 공해 악취 ,Culture
국가 검진 속 숨은 당뇨병 환자   투 트랙 으로 찾아야,Culture
  만 보 걷기 는 잊어라  계단  층 오르면 심혈관질환 발병률     뚝,Culture
올가을 들어 가장 추운 아침 설악산   설천봉 영하로  뚝 ,Culture
 아미랑  인체를 싸움의 전쟁터로 만들지 마세요,Culture
검은 머리 한데 묶고 영원한 사랑을  괌 로맨스  함영훈의 멋 맛 쉼 ,Culture
벌써 초겨울 날씨 설악산 영하로  뚝 ,Culture
잔대와 더덕  한의사   건강꿀팁 ,Culture
배도 안고픈데  입이 간다 입이 가  호르몬 탓이라고 ,Culture
 오늘날씨   서울 최저   도  쌀쌀한 출근길 체감온도는 더 낮아,Culture
 날씨  밤사이 기온 뚝  올가을 가장 쌀쌀   서해안 제주 강풍,Culture
 제주날씨  기온 뚝  출근길 쌀쌀해요  거센 바람 주의 ,Culture
  엔솔  세계  위 도요타에 배터리 공급,Culture
내일 아침 기온 더 내려가 바람 강해 추워요,Culture
무너진 이념을 놓지 못하는 사람들  가자  서쪽으로 ,Culture
건축디자인 저작권 어디까지 보호받을 수 있을까  노승완의 공간짓기 ,Culture
          지리산을 부탁해 지리산아 부탁해  ,Culture
 스무디에 플라스틱 조각 가득 장출혈  결국 유산됐다 ,Culture
 무등산 정상   년 만에 상시개방  광주  무등산을 온전히 껴안다,Culture
 날씨  올가을 들어 가장 쌀쌀   서해안 제주 강풍 주의,Culture
 날씨  서울   도  출근길 추워져 경기 강원 산지 서리 얼음,Culture
 날씨  올가을 들어 가장 쌀쌀 내일도 아침 추위 계속,Culture
 왜 이렇게 추워  하루 만에 기온  뚝  올가을 가장 쌀쌀,Culture
쌀쌀한 아침 출근길    강원 산지 첫 얼음,Culture
가을 제철 간식  밤   맛있는 것 고르는 팁,Culture
 무등산 정상   년 만에 상시개방  정상 열린 무등산  이번엔 안 가본 길로 올라볼까 ,Culture
 뿡  뀌기만 하면 고약 내 방귀 냄새 지독한 탓은 ,Culture
비 그치고 쌀쌀한 가을 아침 강원 산간 첫서리 얼음,Culture
팔자주름  미간주름  목주름까지 필러로 팽팽하게  자주 맞아도 될까 ,Culture
 날씨클릭  밤사이 기온 뚝  아침 추위 서해안 강풍 주의,Culture
유인촌 오늘 인사청문회  김윤아 오염수 발언 블랙리스트 쟁점 ,Culture
해치백 무덤서  전설 로  폭스바겐 골프  가성비의 정석,Culture
긴 연휴만큼 불어난 체중 감량에도  골든타임  있다 ,Culture
대리기사로 만난  호통  연예인  그의 차를 운전하다 생긴 일,Culture
 단독  오세훈 시장 재개발 바람 속 백남준 옛집터 기념관 문 닫는다,Culture
 헬스   연휴 때 불어난 몸무게  급찐급빠  가능할까 ,Culture
이순신 장군이 지키던 바다   오늘 이라 더 특별합니다,Culture
러시아  인조 가셔브룸  봉 사고사,Culture
 날씨   서울     도  밤사이 기온 뚝 중부 내륙 서리,Culture
 출근길 날씨  아침 기온 낮아 쌀쌀 서해안 제주에 강풍,Culture
 연애  년만에          사랑하면 살찌는 이유 뭘까 ,Culture
상반기 잘 달린 현대차 기아   피크아웃  우려 지우고  분기까지 질주,Culture
그래도 매운맛   위생 걱정 던  화끈  마라맛 신제품 봇물,Culture
 자주 가던 곳인데  방콕 쇼핑몰 총기 난사에 여행객 불안,Culture
 카드뉴스      년   월   일 오늘의 운세,Culture
혈당 낮추고 노화 막는 풋땅콩 효과 제대로 보려면 ,Culture
 만났습니다  김영수 관장  해외선 한글 찬양  국내는 한글 훼손 안타까워 ,Culture
기아 쏘울   벤틀리 벤테이가  화재 위험  리콜,Culture
가을 환절기 지긋지긋한 알레르기  면역치료 로 해결,Culture
매일  이것  한 잔 마시면  당뇨병 위험 감소,Culture
러시아 불곰  웅담 이 돌아왔다   간질환 특효,Culture
비 그치고 찬 공기 남하해  쌀쌀  강원 산간 첫서리 얼음 오늘날씨 ,Culture
찬바람에 밤사이   도 뚝 오늘 아침 올가을 최저,Culture
김수현 전 청와대 정책실장   정부는 집값을 못 잡았다 ,Culture
밥에 잡곡 많이 섞을수록 좋을까    가지  넘었다간 ,Culture
 물 반 한국인 반  오사카 도쿄 질렸다면   소도시의 손짓,Culture
 헬스    눈 가렵고 충혈까지   알레르기 환자     만 시대,Culture
  한국이 싫어서 가 왜 개막작인가  외신들 거듭 물어봤다  부산국제영화제 ,Culture
 오늘 날씨  성큼 다가온 가을  아침 최저 기온  도까지 떨어져,Culture
  번 검사했는데   번 문제없다는 강남 한복판 악취   주민들  검사를 저녁에 해야   출구 없는 사회적 공해 악취 ,Culture
 더사주 오늘의 띠별 운세     월  일 목요일 음력  월  일  ,Culture
 가정예배       월  일  아침에 기도하는 이유,Culture
 죄에 대한 형벌이 없다면 무정부 상태가 될 것 ,Culture
툭하면 버럭  물건 깜박  혹시 나도      ,Culture
 시인  딸  아내  엄마로 살아낼 수 있었던 건 이 못생긴 손 덕분 ,Culture
명절 잔칫상 즐긴 뒤 악화된  치질   환절기엔 더 주의를,Culture
 조황  창원 유등수로     대물 붕어  입질 ,Culture
 죽을힘 다해 왜선    여 척 격파  이순신 장군이 기록한 부산포 대승,Culture
 근교산 그너머         양산 천성산 화엄벌,Culture
 이한우의 간신열전        공자의 명     노자의 명   ,Culture
 날씨   찬 공기 남하  태풍 막았다    오늘 산간 첫서리 얼음,Culture
몸싸움까지 일으킨  셰리 위스키 의 오크 통은 어디로 갔나 김지호의 위스키디아 ,Culture
 쿠팡 대표번호 였는데  알바 구인 문자  스미싱이었다,Culture
 오늘의 날씨  아침 최저  도  뚝  강원산지에 얼음,Culture
요즘     은 소맥 와인보다  이 술   맛도 좋은데 배달도 되네  ,Culture
 라인  날씨  밤사이 기온 낮아져 출근길  쌀쌀 ,Culture
내일 강원 산지 첫서리 얼음 관측 예상  평년보다 보름 빨라 ,Culture
배에서 꾸르륵  설사   이 음식  먹었다간 더 악화,Culture
 생활날씨  밤까지 중부 전북  비  찬공기 유입  내일 출근길 쌀쌀,Culture
 명칭과 의미 마음에 안 들어   올드머니 룩 에 소비자가 뿔났다 ,Culture
혈압 정상이어도  이 증상  있으면 위험,Culture
현대차 러시아 철수설  텔레그램 타고 퍼져 반박설도,Culture
  년 만에 광고 뜬 이효리 전지현 제니 이어 또 빅모델 나섰다,Culture
유산소 운동하기 전   이 음료  조심해야 하는 이유,Culture
 뉴스  날씨  밤사이 기온 낮아져 출근길  쌀쌀 ,Culture
    이사회  사장 후보자 임명 제청 무산   일로 미뤄,Culture
 날씨   천둥 번개 동반  요란한 비 수도권      ,Culture
용을 타고 나르샤  섬진강 굽어보는 짜릿한 하늘길,Culture
 날씨  밤까지 중부 전북 요란한  비  내일 아침 쌀쌀,Culture
국적불명의 맹탕 매운탕  여긴 없어서 못 먹는다  일본정원사 입문기 ,Culture
강화의 장자교회  힘찬 재도전 ,Culture
 김치   한국말로 셀카 찍은 주윤발  송강호  큰 형님 오셨다   부산국제영화제 개막 ,Culture
 박민 이영풍 최재훈 셋 다 글쎄다       사장 후보자 임명제청 무산,Culture
  제로 탕후루  건강에 괜찮은가요   전문가 답변은  이슈  ,Culture
